query,id,timestamp_utc,local_time,user_screen_name,text,possibly_sensitive,retweet_count,like_count,reply_count,lang,to_username,to_userid,to_tweetid,source_name,source_url,user_location,lat,lng,user_id,user_name,user_verified,user_description,user_url,user_image,user_tweets,user_followers,user_friends,user_likes,user_lists,user_created_at,user_timestamp_utc,collected_via,match_query,retweeted_id,retweeted_user,retweeted_user_id,retweeted_timestamp_utc,quoted_id,quoted_user,quoted_user_id,quoted_timestamp_utc,collection_time,url,place_country_code,place_name,place_type,place_coordinates,links,domains,media_urls,media_files,media_types,mentioned_names,mentioned_ids,hashtags,intervention_type,intervention_text,intervention_url
from:@etalab,1328986445391015937,1605690034,2020-11-18T09:00:34,Etalab,"Optimiser le traitement des signalements des événements sanitaires indésirables avec l’#IA : RDV aujourd’hui avec les équipes de la DGS @MinSoliSante, l’@ansm et l’ANS @esante_gouv_fr pour découvrir les résultats !

Ce mercredi 18 nov de 17h à 17h30 👉 https://www.eventbrite.fr/e/billets-decouvrez-5-projets-pour-innover-avec-lia-dans-ladministration-126554861999",0,0,8,0,fr,,,,Twitter for iPad,http://twitter.com/#!/download/ipad,France,,,311880926,Etalab,1,Service du Premier ministre qui met à disposition et utilise les données pour améliorer l’action publique. L’équipe derrière @datagouvfr et @eigforever.,http://www.etalab.gouv.fr,https://pbs.twimg.com/profile_images/1067688380111171584/2ZRwOuxE_normal.jpg,4907,33246,250,1849,1261,2011-06-06T06:47:23,1307342843,scraping,1,,,,,,,,,2022-03-22T07:15:22.196187,https://twitter.com/Etalab/statuses/1328986445391015937,,,,,https://www.eventbrite.fr/e/billets-decouvrez-5-projets-pour-innover-avec-lia-dans-ladministration-126554861999,eventbrite.fr,,,,ansm|esante_gouv_fr,2443530930|160541317,ia,,,
from:@etalab,1328699419278053377,1605621602,2020-11-17T14:00:02,Etalab,"Retrouvez le Lab IA d’Etalab aux RDV des Transformations du droit pour échanger autour de la #pseudonymisation des décisions de justice aux côtés de la @Courdecassation et du @Conseil_Etat ce jeudi 19 nov ! @psorianom @pa_chevalier 

Plus d’infos et inscriptions :",,4,5,0,fr,,,,Twitter for iPad,http://twitter.com/#!/download/ipad,France,,,311880926,Etalab,1,Service du Premier ministre qui met à disposition et utilise les données pour améliorer l’action publique. L’équipe derrière @datagouvfr et @eigforever.,http://www.etalab.gouv.fr,https://pbs.twimg.com/profile_images/1067688380111171584/2ZRwOuxE_normal.jpg,4907,33246,250,1849,1261,2011-06-06T06:47:23,1307342843,scraping,1,,,,,1326129881051181057,OpenLaw_fr,2803929450,1605008976,2022-03-22T07:15:22.196970,https://twitter.com/Etalab/statuses/1328699419278053377,,,,,https://lnkd.in/dh8vBfV,lnkd.in,https://video.twimg.com/tweet_video/EmdcF9oXMAA2Ofx.mp4,1326129881051181057_EmdcF9oXMAA2Ofx.mp4,animated_gif,conseil_etat|courdecassation|etalab|pa_chevalier|psorianom|villagejustice,398000696|305116699|311880926|760222838|184199979|393350471,pseudonymisation,,,
from:@etalab,1328624941420470272,1605603845,2020-11-17T09:04:05,Etalab,"Identifier et regrouper des requêtes similaires avec l’intelligence artificielle pour accélérer les délais de jugement : RDV aujourd’hui avec l’équipe du @Conseil_Etat pour découvrir les résultats !

Ce mardi 17 novembre de 17h à 17h30 👉 https://www.eventbrite.fr/e/billets-decouvrez-5-projets-pour-innover-avec-lia-dans-ladministration-126554861999",0,3,7,0,fr,,,,Twitter for iPad,http://twitter.com/#!/download/ipad,France,,,311880926,Etalab,1,Service du Premier ministre qui met à disposition et utilise les données pour améliorer l’action publique. L’équipe derrière @datagouvfr et @eigforever.,http://www.etalab.gouv.fr,https://pbs.twimg.com/profile_images/1067688380111171584/2ZRwOuxE_normal.jpg,4907,33246,250,1849,1261,2011-06-06T06:47:23,1307342843,scraping,1,,,,,,,,,2022-03-22T07:15:22.197298,https://twitter.com/Etalab/statuses/1328624941420470272,,,,,https://www.eventbrite.fr/e/billets-decouvrez-5-projets-pour-innover-avec-lia-dans-ladministration-126554861999,eventbrite.fr,,,,conseil_etat,398000696,,,,
from:@etalab,1328343077698859008,1605536643,2020-11-16T14:24:03,Etalab,"🥁Administrations publiques, le 1er appel à projets #FranceRelance pour développer l'utilisation de la donnée est ouvert.

📆Vous avez jusqu'au 19 décembre pour candidater 👉https://www.demarches-simplifiees.fr/commencer/developper-l-utilisation-de-la-donnee-dans-votre-a

🔍Plus d'infos https://www.demarches-simplifiees.fr/commencer/developper-l-utilisation-de-la-donnee-dans-votre-a",0,10,15,0,fr,,,,Twitter Web App,https://mobile.twitter.com,France,,,311880926,Etalab,1,Service du Premier ministre qui met à disposition et utilise les données pour améliorer l’action publique. L’équipe derrière @datagouvfr et @eigforever.,http://www.etalab.gouv.fr,https://pbs.twimg.com/profile_images/1067688380111171584/2ZRwOuxE_normal.jpg,4907,33246,250,1849,1261,2011-06-06T06:47:23,1307342843,scraping,1,,,,,,,,,2022-03-22T07:15:22.197664,https://twitter.com/Etalab/statuses/1328343077698859008,,,,,https://www.demarches-simplifiees.fr/commencer/developper-l-utilisation-de-la-donnee-dans-votre-a,demarches-simplifiees.fr,,,,,,francerelance,,,
from:@etalab,1328263663707435008,1605517710,2020-11-16T09:08:30,Etalab,"Faciliter l’accès aux informations sur le patient avec l’intelligence artificielle : RDV aujourd’hui avec l’équipe du CHU de Bordeaux pour découvrir les résultats ! #IA #moisdelinnovationpublique

Ce lundi 16 nov de 17h à 17h30 👉 https://www.eventbrite.fr/e/billets-decouvrez-5-projets-pour-innover-avec-lia-dans-ladministration-126554861999",0,5,12,0,fr,,,,Twitter for iPad,http://twitter.com/#!/download/ipad,France,,,311880926,Etalab,1,Service du Premier ministre qui met à disposition et utilise les données pour améliorer l’action publique. L’équipe derrière @datagouvfr et @eigforever.,http://www.etalab.gouv.fr,https://pbs.twimg.com/profile_images/1067688380111171584/2ZRwOuxE_normal.jpg,4907,33246,250,1849,1261,2011-06-06T06:47:23,1307342843,scraping,1,,,,,,,,,2022-03-22T07:15:22.197979,https://twitter.com/Etalab/statuses/1328263663707435008,,,,,https://www.eventbrite.fr/e/billets-decouvrez-5-projets-pour-innover-avec-lia-dans-ladministration-126554861999,eventbrite.fr,,,,,,ia|moisdelinnovationpublique,,,
from:@etalab,1326087021320925185,1604998758,2020-11-10T08:59:18,Etalab,5/5 Développer un outil d’aide à l’implantation des entreprises en Nouvelle-Aquitaine (CRMANA),,0,1,0,fr,Etalab,311880926,1326086395501404160,Twitter for iPad,http://twitter.com/#!/download/ipad,France,,,311880926,Etalab,1,Service du Premier ministre qui met à disposition et utilise les données pour améliorer l’action publique. L’équipe derrière @datagouvfr et @eigforever.,http://www.etalab.gouv.fr,https://pbs.twimg.com/profile_images/1067688380111171584/2ZRwOuxE_normal.jpg,4907,33246,250,1849,1261,2011-06-06T06:47:23,1307342843,scraping,1,,,,,,,,,2022-03-22T07:15:22.198229,https://twitter.com/Etalab/statuses/1326087021320925185,,,,,,,,,,,,,,,
from:@etalab,1326086947975155712,1604998740,2020-11-10T08:59:00,Etalab,4/5 Identifier les molécules contaminant l’environnement (INERIS),,0,1,0,fr,Etalab,311880926,1326086395501404160,Twitter for iPad,http://twitter.com/#!/download/ipad,France,,,311880926,Etalab,1,Service du Premier ministre qui met à disposition et utilise les données pour améliorer l’action publique. L’équipe derrière @datagouvfr et @eigforever.,http://www.etalab.gouv.fr,https://pbs.twimg.com/profile_images/1067688380111171584/2ZRwOuxE_normal.jpg,4907,33246,250,1849,1261,2011-06-06T06:47:23,1307342843,scraping,1,,,,,,,,,2022-03-22T07:15:22.198466,https://twitter.com/Etalab/statuses/1326086947975155712,,,,,,,,,,,,,,,
from:@etalab,1326086769654304769,1604998698,2020-11-10T08:58:18,Etalab,2/5 Identifier et regrouper des requêtes similaires pour accélerer les délais de jugement (Conseil d’Etat),,0,1,0,fr,Etalab,311880926,1326086395501404160,Twitter for iPad,http://twitter.com/#!/download/ipad,France,,,311880926,Etalab,1,Service du Premier ministre qui met à disposition et utilise les données pour améliorer l’action publique. L’équipe derrière @datagouvfr et @eigforever.,http://www.etalab.gouv.fr,https://pbs.twimg.com/profile_images/1067688380111171584/2ZRwOuxE_normal.jpg,4907,33246,250,1849,1261,2011-06-06T06:47:23,1307342843,scraping,1,,,,,,,,,2022-03-22T07:15:22.198711,https://twitter.com/Etalab/statuses/1326086769654304769,,,,,,,,,,,,,,,
from:@etalab,1326086666507997184,1604998673,2020-11-10T08:57:53,Etalab,Les cinq projets présentés : 1/5 Faciliter l’accès aux informations sur les patients (CHU Bordeaux),,0,1,0,fr,Etalab,311880926,1326086395501404160,Twitter for iPad,http://twitter.com/#!/download/ipad,France,,,311880926,Etalab,1,Service du Premier ministre qui met à disposition et utilise les données pour améliorer l’action publique. L’équipe derrière @datagouvfr et @eigforever.,http://www.etalab.gouv.fr,https://pbs.twimg.com/profile_images/1067688380111171584/2ZRwOuxE_normal.jpg,4907,33246,250,1849,1261,2011-06-06T06:47:23,1307342843,scraping,1,,,,,,,,,2022-03-22T07:15:22.198953,https://twitter.com/Etalab/statuses/1326086666507997184,,,,,,,,,,,,,,,
from:@etalab,1326086395501404160,1604998608,2020-11-10T08:56:48,Etalab,"Le Lab IA d’Etalab et la @_DITP accompagnent les administrations pour expérimenter l’#IA. Du 16 au 20 novembre, venez découvrir 5 projets accompagnés en 2020 ! #moisdelinnovationpublique 

👉 tous les jours de 17h à 17h30, programme et inscriptions : https://www.eventbrite.fr/e/billets-les-pitchs-5-projets-pour-innover-avec-lia-dans-ladministration-126554861999",0,4,10,5,fr,,,,Twitter for iPad,http://twitter.com/#!/download/ipad,France,,,311880926,Etalab,1,Service du Premier ministre qui met à disposition et utilise les données pour améliorer l’action publique. L’équipe derrière @datagouvfr et @eigforever.,http://www.etalab.gouv.fr,https://pbs.twimg.com/profile_images/1067688380111171584/2ZRwOuxE_normal.jpg,4907,33246,250,1849,1261,2011-06-06T06:47:23,1307342843,scraping,1,,,,,,,,,2022-03-22T07:15:22.199245,https://twitter.com/Etalab/statuses/1326086395501404160,,,,,https://www.eventbrite.fr/e/billets-les-pitchs-5-projets-pour-innover-avec-lia-dans-ladministration-126554861999,eventbrite.fr,,,,_ditp,159161738,ia|moisdelinnovationpublique,,,
from:@etalab,1323929504474140672,1604484365,2020-11-04T10:06:05,Etalab,"Les RDV d’Etalab au #Moisdelinnovationpublique: ateliers, retours d’expérience, lancement de nouvelles offres d’accompagnements et d’appels à projets, présentation de nos actions... On vous attend nombreuses et nombreux !

Les inscriptions sont ouvertes 👉 https://www.etalab.gouv.fr/rdv-etalab-mip-2020",0,9,10,1,fr,,,,Twitter for iPad,http://twitter.com/#!/download/ipad,France,,,311880926,Etalab,1,Service du Premier ministre qui met à disposition et utilise les données pour améliorer l’action publique. L’équipe derrière @datagouvfr et @eigforever.,http://www.etalab.gouv.fr,https://pbs.twimg.com/profile_images/1067688380111171584/2ZRwOuxE_normal.jpg,4907,33246,250,1849,1261,2011-06-06T06:47:23,1307342843,scraping,1,,,,,,,,,2022-03-22T07:15:22.199546,https://twitter.com/Etalab/statuses/1323929504474140672,,,,,https://www.etalab.gouv.fr/rdv-etalab-mip-2020,etalab.gouv.fr,,,,,,moisdelinnovationpublique,,,
from:@etalab,1323551116127252481,1604394151,2020-11-03T09:02:31,Etalab,@macgraveur @RomainTales Il y a un volet spécifique pour les collectivités prévu dans le cadre de l'enveloppe Innovation et transformation numérique. Les informations seront bientôt disponibles sur à l'url suivante https://france-relance.transformation.gouv.fr/,0,1,3,2,fr,macgraveur,486578816,1323550085301575680,Twitter Web App,https://mobile.twitter.com,France,,,311880926,Etalab,1,Service du Premier ministre qui met à disposition et utilise les données pour améliorer l’action publique. L’équipe derrière @datagouvfr et @eigforever.,http://www.etalab.gouv.fr,https://pbs.twimg.com/profile_images/1067688380111171584/2ZRwOuxE_normal.jpg,4907,33246,250,1849,1261,2011-06-06T06:47:23,1307342843,scraping,1,,,,,,,,,2022-03-22T07:15:22.199859,https://twitter.com/Etalab/statuses/1323551116127252481,,,,,https://france-relance.transformation.gouv.fr,france-relance.transformation.gouv.fr,,,,macgraveur|romaintales,486578816|376302887,,,,
from:@etalab,1323545311718055936,1604392767,2020-11-03T08:39:27,Etalab,"Administrations publiques, vous souhaitez développer l’utilisation de la donnée dans votre administration (IA, décisionnel, échange de données, open data, ...)

Découvrez l'appel à projets👉 https://france-relance.transformation.gouv.fr/96c0-developper-lutilisation-de-la-donnee-dans-vot

Pour en savoir plus, rdv le 10 novembre: https://www.eventbrite.fr/e/billets-reunion-dinformation-appel-a-projets-cycle-de-vie-de-la-donnee-127000853973 https://twitter.com/Etalab/status/1323545311718055936/photo/1",0,26,31,0,fr,,,,Twitter Web App,https://mobile.twitter.com,France,,,311880926,Etalab,1,Service du Premier ministre qui met à disposition et utilise les données pour améliorer l’action publique. L’équipe derrière @datagouvfr et @eigforever.,http://www.etalab.gouv.fr,https://pbs.twimg.com/profile_images/1067688380111171584/2ZRwOuxE_normal.jpg,4907,33246,250,1849,1261,2011-06-06T06:47:23,1307342843,scraping,1,,,,,,,,,2022-03-22T07:15:22.200386,https://twitter.com/Etalab/statuses/1323545311718055936,,,,,https://france-relance.transformation.gouv.fr/96c0-developper-lutilisation-de-la-donnee-dans-vot|https://www.eventbrite.fr/e/billets-reunion-dinformation-appel-a-projets-cycle-de-vie-de-la-donnee-127000853973,france-relance.transformation.gouv.fr|eventbrite.fr,https://pbs.twimg.com/media/El4sOtHXgAI7Kxh.jpg,1323545311718055936_El4sOtHXgAI7Kxh.jpg,photo,,,,,,
from:@etalab,1308027251884163074,1600692973,2020-09-21T12:56:13,Etalab,"Etalab lance une enquête sur les pratiques de publication de #codesource du secteur public (en dehors de l'enseignement supérieur et de la recherche).  Ce questionnaire vous prendra 5 à 15 minutes, n'hésitez pas à la faire suivre à vos collègues ! 👉https://framaforms.org/pratiques-de-publication-de-code-source-du-secteur-public-hors-esr-1600673740",0,63,34,2,fr,,,,Twitter for iPad,http://twitter.com/#!/download/ipad,France,,,311880926,Etalab,1,Service du Premier ministre qui met à disposition et utilise les données pour améliorer l’action publique. L’équipe derrière @datagouvfr et @eigforever.,http://www.etalab.gouv.fr,https://pbs.twimg.com/profile_images/1067688380111171584/2ZRwOuxE_normal.jpg,4907,33246,250,1849,1261,2011-06-06T06:47:23,1307342843,scraping,1,,,,,,,,,2022-03-22T07:15:22.200697,https://twitter.com/Etalab/statuses/1308027251884163074,,,,,https://framaforms.org/pratiques-de-publication-de-code-source-du-secteur-public-hors-esr-1600673740,framaforms.org,,,,,,codesource,,,
from:@etalab,1301533480610926599,1599144737,2020-09-03T14:52:17,Etalab,🧢 Nous lançons une consultation sur les pratiques de publication des #codessources de l'enseignement supérieur et la recherche.  Voici le questionnaire à remplir (15 minutes) et à relayer dans vos réseaux : https://sondage.inno3.cricket/index.php?r=survey/index&sid=592911 #BlueHats,0,126,64,4,fr,,,,Twitter for iPad,http://twitter.com/#!/download/ipad,France,,,311880926,Etalab,1,Service du Premier ministre qui met à disposition et utilise les données pour améliorer l’action publique. L’équipe derrière @datagouvfr et @eigforever.,http://www.etalab.gouv.fr,https://pbs.twimg.com/profile_images/1067688380111171584/2ZRwOuxE_normal.jpg,4907,33246,250,1849,1261,2011-06-06T06:47:23,1307342843,scraping,1,,,,,,,,,2022-03-22T07:15:22.201055,https://twitter.com/Etalab/statuses/1301533480610926599,,,,,https://sondage.inno3.cricket?r=survey/index&sid=592911,sondage.inno3.cricket,,,,,,bluehats|codessources,,,
from:@etalab,1290304053193441280,1596467433,2020-08-03T15:10:33,Etalab,"@laspaelleras Trois jeux de données francophones combinés sont utilisés, voir ici : https://www.data.gouv.fr/fr/reuses/modele-de-questions-reponses-francophone/",0,0,2,0,fr,,,,Twitter for iPad,http://twitter.com/#!/download/ipad,France,,,311880926,Etalab,1,Service du Premier ministre qui met à disposition et utilise les données pour améliorer l’action publique. L’équipe derrière @datagouvfr et @eigforever.,http://www.etalab.gouv.fr,https://pbs.twimg.com/profile_images/1067688380111171584/2ZRwOuxE_normal.jpg,4907,33246,250,1849,1261,2011-06-06T06:47:23,1307342843,scraping,1,,,,,,,,,2022-03-22T07:15:22.201359,https://twitter.com/Etalab/statuses/1290304053193441280,,,,,https://www.data.gouv.fr/fr/reuses/modele-de-questions-reponses-francophone/,data.gouv.fr,,,,laspaelleras,,,,,
from:@etalab,1290281253963329536,1596461997,2020-08-03T13:39:57,Etalab,"Grâce aux jeux de données francophones, à #PIAF et à vos contributions, le Lab IA d’@Etalab a publié un modèle de questions-réponses en français sur @huggingFace : à tester ici pour vos applications, partagez-nous vos réutilisations ! #NLP 👉https://huggingface.co/etalab-ia/camembert-base-squadFR-fquad-piaf https://twitter.com/Etalab/status/1290281253963329536/photo/1",0,24,64,1,fr,,,,Twitter for iPad,http://twitter.com/#!/download/ipad,France,,,311880926,Etalab,1,Service du Premier ministre qui met à disposition et utilise les données pour améliorer l’action publique. L’équipe derrière @datagouvfr et @eigforever.,http://www.etalab.gouv.fr,https://pbs.twimg.com/profile_images/1067688380111171584/2ZRwOuxE_normal.jpg,4907,33246,250,1849,1261,2011-06-06T06:47:23,1307342843,scraping,1,,,,,,,,,2022-03-22T07:15:22.201807,https://twitter.com/Etalab/statuses/1290281253963329536,,,,,https://huggingface.co/etalab-ia/camembert-base-squadFR-fquad-piaf,huggingface.co,https://pbs.twimg.com/media/Eef_9eZWkAQISMq.jpg,1290281253963329536_Eef_9eZWkAQISMq.jpg,photo,etalab|huggingface,311880926|778764142412984320,nlp|piaf,,,
from:@etalab,1281263156250238977,1594311915,2020-07-09T16:25:15,Etalab,"[Webinaire] Transparence des algorithmes publics et mention explicite obligatoire : quelles administrations sont concernées ? Quelles sont les obligations ? Et comment faire, concrètement ? 

A voir ou revoir en ligne👉https://www.etalab.gouv.fr/transparence-des-algorithmes-publics-regardez-le-webinaire-a-lintention-des-administrations",0,22,20,0,fr,,,,Twitter Web App,https://mobile.twitter.com,France,,,311880926,Etalab,1,Service du Premier ministre qui met à disposition et utilise les données pour améliorer l’action publique. L’équipe derrière @datagouvfr et @eigforever.,http://www.etalab.gouv.fr,https://pbs.twimg.com/profile_images/1067688380111171584/2ZRwOuxE_normal.jpg,4907,33246,250,1849,1261,2011-06-06T06:47:23,1307342843,scraping,1,,,,,,,,,2022-03-22T07:15:22.202140,https://twitter.com/Etalab/statuses/1281263156250238977,,,,,https://www.etalab.gouv.fr/transparence-des-algorithmes-publics-regardez-le-webinaire-a-lintention-des-administrations,etalab.gouv.fr,,,,,,,,,
from:@etalab,1278332921997336580,1593613293,2020-07-01T14:21:33,Etalab,"Défi @eigforever Label avec la Cour de Cassation, pour accélérer l’ouverture des décisions de justice : https://entrepreneur-interet-general.etalab.gouv.fr/defis/2020/label.htm",0,2,4,0,fr,Etalab,311880926,1278332920843898880,Twitter for iPad,http://twitter.com/#!/download/ipad,France,,,311880926,Etalab,1,Service du Premier ministre qui met à disposition et utilise les données pour améliorer l’action publique. L’équipe derrière @datagouvfr et @eigforever.,http://www.etalab.gouv.fr,https://pbs.twimg.com/profile_images/1067688380111171584/2ZRwOuxE_normal.jpg,4907,33246,250,1849,1261,2011-06-06T06:47:23,1307342843,scraping,1,,,,,,,,,2022-03-22T07:15:22.459315,https://twitter.com/Etalab/statuses/1278332921997336580,,,,,https://entrepreneur-interet-general.etalab.gouv.fr/defis/2020/label.htm,entrepreneur-interet-general.etalab.gouv.fr,,,,eigforever,959462629407379456,,,,
from:@etalab,1278332920843898880,1593613293,2020-07-01T14:21:33,Etalab,"Défi @eigforever OpenJustice avec la Cour de Cassation, pour ouvrir la jurisprudence par la pseudonymisation des données : https://entrepreneur-interet-general.etalab.gouv.fr/defis/2019/openjustice.html",0,2,5,1,fr,Etalab,311880926,1278332919694741506,Twitter for iPad,http://twitter.com/#!/download/ipad,France,,,311880926,Etalab,1,Service du Premier ministre qui met à disposition et utilise les données pour améliorer l’action publique. L’équipe derrière @datagouvfr et @eigforever.,http://www.etalab.gouv.fr,https://pbs.twimg.com/profile_images/1067688380111171584/2ZRwOuxE_normal.jpg,4907,33246,250,1849,1261,2011-06-06T06:47:23,1307342843,scraping,1,,,,,,,,,2022-03-22T07:15:22.459673,https://twitter.com/Etalab/statuses/1278332920843898880,,,,,https://entrepreneur-interet-general.etalab.gouv.fr/defis/2019/openjustice.html,entrepreneur-interet-general.etalab.gouv.fr,,,,eigforever,959462629407379456,,,,
from:@etalab,1278332919694741506,1593613292,2020-07-01T14:21:32,Etalab,Guides d’Etalab : pseudonymiser des documents grâce à l’IA https://guides.etalab.gouv.fr/pseudonymisation/#a-quoi-sert-ce-guide-,0,1,2,1,fr,Etalab,311880926,1278332918545494018,Twitter for iPad,http://twitter.com/#!/download/ipad,France,,,311880926,Etalab,1,Service du Premier ministre qui met à disposition et utilise les données pour améliorer l’action publique. L’équipe derrière @datagouvfr et @eigforever.,http://www.etalab.gouv.fr,https://pbs.twimg.com/profile_images/1067688380111171584/2ZRwOuxE_normal.jpg,4907,33246,250,1849,1261,2011-06-06T06:47:23,1307342843,scraping,1,,,,,,,,,2022-03-22T07:15:22.460031,https://twitter.com/Etalab/statuses/1278332919694741506,,,,,https://guides.etalab.gouv.fr/pseudonymisation/#a-quoi-sert-ce-guide-,guides.etalab.gouv.fr,,,,,,a,,,
from:@etalab,1278332918545494018,1593613292,2020-07-01T14:21:32,Etalab,Démonstration de l’outil d’IA de pseudonymisation open source développé par le Lab IA pour le Conseil d’Etat : https://datascience.etalab.studio/pseudo/,0,2,3,1,fr,Etalab,311880926,1278332916410580992,Twitter for iPad,http://twitter.com/#!/download/ipad,France,,,311880926,Etalab,1,Service du Premier ministre qui met à disposition et utilise les données pour améliorer l’action publique. L’équipe derrière @datagouvfr et @eigforever.,http://www.etalab.gouv.fr,https://pbs.twimg.com/profile_images/1067688380111171584/2ZRwOuxE_normal.jpg,4907,33246,250,1849,1261,2011-06-06T06:47:23,1307342843,scraping,1,,,,,,,,,2022-03-22T07:15:22.460349,https://twitter.com/Etalab/statuses/1278332918545494018,,,,,https://datascience.etalab.studio/pseudo/,datascience.etalab.studio,,,,,,,,,
from:@etalab,1278332916410580992,1593613292,2020-07-01T14:21:32,Etalab,Décret n° 2020-797 du 29 juin 2020 relatif à la mise à la disposition du public des décisions des juridictions judiciaires et administratives > https://www.legifrance.gouv.fr/eli/decret/2020/6/29/JUST1933453D/jo/texte,0,0,1,1,fr,Etalab,311880926,1278331481484677121,Twitter for iPad,http://twitter.com/#!/download/ipad,France,,,311880926,Etalab,1,Service du Premier ministre qui met à disposition et utilise les données pour améliorer l’action publique. L’équipe derrière @datagouvfr et @eigforever.,http://www.etalab.gouv.fr,https://pbs.twimg.com/profile_images/1067688380111171584/2ZRwOuxE_normal.jpg,4907,33246,250,1849,1261,2011-06-06T06:47:23,1307342843,scraping,1,,,,,,,,,2022-03-22T07:15:22.460680,https://twitter.com/Etalab/statuses/1278332916410580992,,,,,https://www.legifrance.gouv.fr/eli/decret/2020/6/29/JUST1933453D/jo/texte,legifrance.gouv.fr,,,,,,,,,
from:@etalab,1278331481484677121,1593612950,2020-07-01T14:15:50,Etalab,"Décret n°2020-797 du 29 juin : les décisions de justice mises à disposition du public ! Pour les publier en #opendata, Etalab travaille avec le @Conseil_Etat et la @Courdecassation en occultant les éléments d’identification des personnes avec l’#IA #pseudonymisation👇 https://twitter.com/Etalab/status/1278331481484677121/photo/1",0,49,62,2,fr,,,,Twitter for iPad,http://twitter.com/#!/download/ipad,France,,,311880926,Etalab,1,Service du Premier ministre qui met à disposition et utilise les données pour améliorer l’action publique. L’équipe derrière @datagouvfr et @eigforever.,http://www.etalab.gouv.fr,https://pbs.twimg.com/profile_images/1067688380111171584/2ZRwOuxE_normal.jpg,4907,33246,250,1849,1261,2011-06-06T06:47:23,1307342843,scraping,1,,,,,,,,,2022-03-22T07:15:22.461078,https://twitter.com/Etalab/statuses/1278331481484677121,,,,,,,https://pbs.twimg.com/media/Eb2LtDUWsAIVWwM.jpg,1278331481484677121_Eb2LtDUWsAIVWwM.jpg,photo,conseil_etat|courdecassation,398000696|305116699,ia|opendata|pseudonymisation,,,
