query,id,timestamp_utc,local_time,user_screen_name,text,possibly_sensitive,retweet_count,like_count,reply_count,lang,to_username,to_userid,to_tweetid,source_name,source_url,user_location,lat,lng,user_id,user_name,user_verified,user_description,user_url,user_image,user_tweets,user_followers,user_friends,user_likes,user_lists,user_created_at,user_timestamp_utc,collected_via,match_query,retweeted_id,retweeted_user,retweeted_user_id,retweeted_timestamp_utc,quoted_id,quoted_user,quoted_user_id,quoted_timestamp_utc,collection_time,url,place_country_code,place_name,place_type,place_coordinates,links,domains,media_urls,media_files,media_types,mentioned_names,mentioned_ids,hashtags,intervention_type,intervention_text,intervention_url
from:@etalab,1468921745809752071,1639053210,2021-12-09T12:33:30,Etalab,"L'Open Data Maturity Report de la @UEFrance place la France a la première place devant l'Irlande et l'Espagne.
Bravo aux équipes, aux producteurs de données, aux réutilisateurs et à tous les acteurs de l'#OpenData pour cette réussite collective ! https://twitter.com/Etalab/status/1468921745809752071/photo/1",0,96,239,7,fr,,,,Twitter Web App,https://mobile.twitter.com,France,,,311880926,Etalab,1,Service du Premier ministre qui met à disposition et utilise les données pour améliorer l’action publique. L’équipe derrière @datagouvfr et @eigforever.,http://www.etalab.gouv.fr,https://pbs.twimg.com/profile_images/1067688380111171584/2ZRwOuxE_normal.jpg,4827,33061,211,1764,1259,2011-06-06T06:47:23,1307342843,scraping,1,,,,,,,,,2021-12-13T07:16:29.556268,https://twitter.com/Etalab/statuses/1468921745809752071,,,,,,,https://pbs.twimg.com/media/FGKcPPSXoAIo11h.jpg,1468921745809752071_FGKcPPSXoAIo11h.jpg,photo,uefrance,484872080,opendata,,,
from:@etalab,1467877798417207299,1638804313,2021-12-06T15:25:13,Etalab,"[🚨Job Alert🚨] : Le Lab IA est à la recherche de sa ou son futur(e) lead data scientist. 

Toutes les infos sur le job : 

https://www.etalab.gouv.fr/le-lab-ia-recrute-sa-ou-son-lead-data-scientist https://twitter.com/Etalab/status/1467877798417207299/photo/1",0,15,11,0,fr,,,,TweetDeck,https://about.twitter.com/products/tweetdeck,France,,,311880926,Etalab,1,Service du Premier ministre qui met à disposition et utilise les données pour améliorer l’action publique. L’équipe derrière @datagouvfr et @eigforever.,http://www.etalab.gouv.fr,https://pbs.twimg.com/profile_images/1067688380111171584/2ZRwOuxE_normal.jpg,4827,33061,211,1764,1259,2011-06-06T06:47:23,1307342843,scraping,1,,,,,,,,,2021-12-13T07:16:29.557113,https://twitter.com/Etalab/statuses/1467877798417207299,,,,,https://www.etalab.gouv.fr/le-lab-ia-recrute-sa-ou-son-lead-data-scientist,etalab.gouv.fr,https://pbs.twimg.com/media/FF7ywd5WYAQhs6U.jpg,1467877798417207299_FF7ywd5WYAQhs6U.jpg,photo,,,,,,
