query,id,timestamp_utc,local_time,user_screen_name,text,possibly_sensitive,retweet_count,like_count,reply_count,lang,to_username,to_userid,to_tweetid,source_name,source_url,user_location,lat,lng,user_id,user_name,user_verified,user_description,user_url,user_image,user_tweets,user_followers,user_friends,user_likes,user_lists,user_created_at,user_timestamp_utc,collected_via,match_query,retweeted_id,retweeted_user,retweeted_user_id,retweeted_timestamp_utc,quoted_id,quoted_user,quoted_user_id,quoted_timestamp_utc,collection_time,url,place_country_code,place_name,place_type,place_coordinates,links,domains,media_urls,media_files,media_types,mentioned_names,mentioned_ids,hashtags,intervention_type,intervention_text,intervention_url
from:@etalab,1458492509089374209,1636566686,2021-11-10T17:51:26,Etalab,"Logiciels libres et communs numériques : Bienvenue et longue vie @codegouvfr 🚀 

A l'occasion de l'@OSXP_Paris, la Ministre @AdeMontchalin a dévoilé le plan d'action ""logiciels libres et communs numériques"" porté par @Etalab @_DINUM #bluehats : https://communs.numerique.gouv.fr/ https://twitter.com/Etalab/status/1458492509089374209/photo/1",0,50,74,1,fr,,,,Twitter Web App,https://mobile.twitter.com,France,,,311880926,Etalab,1,Service du Premier ministre qui met à disposition et utilise les données pour améliorer l’action publique. L’équipe derrière @datagouvfr et @eigforever.,http://www.etalab.gouv.fr,https://pbs.twimg.com/profile_images/1067688380111171584/2ZRwOuxE_normal.jpg,4817,32950,210,1755,1254,2011-06-06T06:47:23,1307342843,scraping,1,,,,,,,,,2021-11-19T07:16:23.854165,https://twitter.com/Etalab/statuses/1458492509089374209,,,,,https://communs.numerique.gouv.fr,communs.numerique.gouv.fr,https://pbs.twimg.com/media/FD2Zn7pXsAM3uFj.png|https://pbs.twimg.com/media/FD2aNnDWEAkSObl.png,1458492509089374209_FD2Zn7pXsAM3uFj.png|1458492509089374209_FD2aNnDWEAkSObl.png,photo|photo,_dinum|ademontchalin|codegouvfr|etalab|osxp_paris,4910809053|800435764966215680|1417500670781964292|311880926|1374637739853893634,bluehats,,,
from:@etalab,1446065108392759304,1633603763,2021-10-07T10:49:23,Etalab,"👋 Tu es #data  / #search Engineer ? Tu aimes l’#opendata ? Tu veux aider des millions d’entrepreneurs à retrouver leurs données ?

Rejoins l’équipe de l’Annuaire des Entreprises : le moteur de recherche des informations des entreprises.

✉️ Pour postuler :https://beta.gouv.fr/recrutement/2021/09/27/search-engineer-annuaire-entreprises.html",0,8,4,0,fr,,,,Twitter Web App,https://mobile.twitter.com,France,,,311880926,Etalab,1,Service du Premier ministre qui met à disposition et utilise les données pour améliorer l’action publique. L’équipe derrière @datagouvfr et @eigforever.,http://www.etalab.gouv.fr,https://pbs.twimg.com/profile_images/1067688380111171584/2ZRwOuxE_normal.jpg,4817,32950,210,1755,1254,2011-06-06T06:47:23,1307342843,scraping,1,,,,,,,,,2021-11-19T07:16:23.854662,https://twitter.com/Etalab/statuses/1446065108392759304,,,,,https://beta.gouv.fr/recrutement/2021/09/27/search-engineer-annuaire-entreprises.html,beta.gouv.fr,,,,,,data|opendata|search,,,
from:@etalab,1445020469204332549,1633354701,2021-10-04T13:38:21,Etalab,"🧢 La journée #BlueHats fait son retour le 9 novembre lors du salon Open Source Experience #OSXP2021 ! Découvrez les retours d’expérience des agents publics autour des logiciels libres dans l'administration.

Plus d'informations ici👉https://www.numerique.gouv.fr/agenda/journee-bluehats-lors-du-salon-open-source-experience/ cc @_DINUM @OSXP_Paris",0,20,23,0,fr,,,,Twitter Web App,https://mobile.twitter.com,France,,,311880926,Etalab,1,Service du Premier ministre qui met à disposition et utilise les données pour améliorer l’action publique. L’équipe derrière @datagouvfr et @eigforever.,http://www.etalab.gouv.fr,https://pbs.twimg.com/profile_images/1067688380111171584/2ZRwOuxE_normal.jpg,4817,32950,210,1755,1254,2011-06-06T06:47:23,1307342843,scraping,1,,,,,,,,,2021-11-19T07:16:23.854998,https://twitter.com/Etalab/statuses/1445020469204332549,,,,,https://www.numerique.gouv.fr/agenda/journee-bluehats-lors-du-salon-open-source-experience/,numerique.gouv.fr,,,,_dinum|osxp_paris,4910809053|1374637739853893634,bluehats|osxp2021,,,
from:@etalab,1442810617358917636,1632827831,2021-09-28T11:17:11,Etalab,"Ces travaux viennent alimenter directement la feuille de route ministérielle #data du ministère de la transformation et de la fonction publiques (https://bit.ly/3m8fbqW, Actions 41 à 45) ainsi que la mission relative aux corps techniques lancée le 2/9 par @JeanCASTEX https://twitter.com/Etalab/status/1442810617358917636/photo/1",0,1,4,0,fr,Etalab,311880926,1442807564400529408,Twitter Web App,https://mobile.twitter.com,France,,,311880926,Etalab,1,Service du Premier ministre qui met à disposition et utilise les données pour améliorer l’action publique. L’équipe derrière @datagouvfr et @eigforever.,http://www.etalab.gouv.fr,https://pbs.twimg.com/profile_images/1067688380111171584/2ZRwOuxE_normal.jpg,4817,32950,210,1755,1254,2011-06-06T06:47:23,1307342843,scraping,1,,,,,,,,,2021-11-19T07:16:23.855431,https://twitter.com/Etalab/statuses/1442810617358917636,,,,,https://bit.ly/3m8fbqW,bit.ly,https://pbs.twimg.com/media/FAXjAoxXsAENpyT.png,1442810617358917636_FAXjAoxXsAENpyT.png,photo,jeancastex,119081177,data,,,
from:@etalab,1442807564400529408,1632827104,2021-09-28T11:05:04,Etalab,"▶️ des actions amplifiant la mise en réseau et son  animation, favorisant la circulation des compétences (💡expérimentation de 10% du temps agent dédiés à des projets collectifs) et renforçant les liens entre administrateurs ministériels des données & services statistiques",,1,3,1,fr,Etalab,311880926,1442806113855016962,Twitter Web App,https://mobile.twitter.com,France,,,311880926,Etalab,1,Service du Premier ministre qui met à disposition et utilise les données pour améliorer l’action publique. L’équipe derrière @datagouvfr et @eigforever.,http://www.etalab.gouv.fr,https://pbs.twimg.com/profile_images/1067688380111171584/2ZRwOuxE_normal.jpg,4817,32950,210,1755,1254,2011-06-06T06:47:23,1307342843,scraping,1,,,,,,,,,2021-11-19T07:16:23.855795,https://twitter.com/Etalab/statuses/1442807564400529408,,,,,,,,,,,,,,,
from:@etalab,1442806113855016962,1632826758,2021-09-28T10:59:18,Etalab,"▶️  des actions permettant d'améliorer les processus RH : indicateurs de rémunération, création d'une fonction de référent métier interministériel et d'outils d'évaluation des compétences (recommandations 4 et 7 notamment)",,1,2,1,fr,Etalab,311880926,1442804891232133125,Twitter Web App,https://mobile.twitter.com,France,,,311880926,Etalab,1,Service du Premier ministre qui met à disposition et utilise les données pour améliorer l’action publique. L’équipe derrière @datagouvfr et @eigforever.,http://www.etalab.gouv.fr,https://pbs.twimg.com/profile_images/1067688380111171584/2ZRwOuxE_normal.jpg,4817,32950,210,1755,1254,2011-06-06T06:47:23,1307342843,scraping,1,,,,,,,,,2021-11-19T07:16:23.856085,https://twitter.com/Etalab/statuses/1442806113855016962,,,,,,,,,,,,,,,
from:@etalab,1442804891232133125,1632826466,2021-09-28T10:54:26,Etalab,"12 recommandations sont formulées, parmi lesquelles :
▶️ des actions destinées à faciliter le recrutement et la fidélisation de ces compétences, tant parmi les fonctionnaires qu'en externe https://twitter.com/Etalab/status/1442804891232133125/photo/1",0,1,4,1,fr,Etalab,311880926,1442803676440154112,Twitter Web App,https://mobile.twitter.com,France,,,311880926,Etalab,1,Service du Premier ministre qui met à disposition et utilise les données pour améliorer l’action publique. L’équipe derrière @datagouvfr et @eigforever.,http://www.etalab.gouv.fr,https://pbs.twimg.com/profile_images/1067688380111171584/2ZRwOuxE_normal.jpg,4817,32950,210,1755,1254,2011-06-06T06:47:23,1307342843,scraping,1,,,,,,,,,2021-11-19T07:16:23.856496,https://twitter.com/Etalab/statuses/1442804891232133125,,,,,,,https://pbs.twimg.com/media/FAXfVM5WYAY_OaU.jpg,1442804891232133125_FAXfVM5WYAY_OaU.jpg,photo,,,,,,
from:@etalab,1442803676440154112,1632826177,2021-09-28T10:49:37,Etalab,"📈 Fruit de 80 auditions auprès des principales directions concernées (mais hors opérateurs), en se concentrant sur 4 métiers, le rapport dénombre :
- plus de 2000 experts de la donnée, dont 700 hors Insee et SSM, fonctionnaires ou contractuels
- un besoin porté à 2400 d'ici 2023 https://twitter.com/Etalab/status/1442803676440154112/photo/1",0,2,3,1,fr,Etalab,311880926,1442799548619968512,Twitter Web App,https://mobile.twitter.com,France,,,311880926,Etalab,1,Service du Premier ministre qui met à disposition et utilise les données pour améliorer l’action publique. L’équipe derrière @datagouvfr et @eigforever.,http://www.etalab.gouv.fr,https://pbs.twimg.com/profile_images/1067688380111171584/2ZRwOuxE_normal.jpg,4817,32950,210,1755,1254,2011-06-06T06:47:23,1307342843,scraping,1,,,,,,,,,2021-11-19T07:16:23.856939,https://twitter.com/Etalab/statuses/1442803676440154112,,,,,,,https://pbs.twimg.com/media/FAXeN0kXIAMRS79.jpg,1442803676440154112_FAXeN0kXIAMRS79.jpg,photo,,,,,,
from:@etalab,1442799548619968512,1632825192,2021-09-28T10:33:12,Etalab,"[Fil] Politique de la donnée / #compétences

📄 Le rapport @_DINUM @InseeFr rendu public hier présente un panorama inédit :
▶️ des expertises #data disponibles dans l’État, 
▶️ des besoins à court et moyen terme 
▶️ des actions à engager pour y faire face

https://www.etalab.gouv.fr/publication-du-rapport-dinum-insee-12-recommandations-pour-dynamiser-la-gestion-et-la-valorisation-des-competences-data https://twitter.com/Etalab/status/1442799548619968512/photo/1",0,19,32,1,fr,,,,Twitter Web App,https://mobile.twitter.com,France,,,311880926,Etalab,1,Service du Premier ministre qui met à disposition et utilise les données pour améliorer l’action publique. L’équipe derrière @datagouvfr et @eigforever.,http://www.etalab.gouv.fr,https://pbs.twimg.com/profile_images/1067688380111171584/2ZRwOuxE_normal.jpg,4817,32950,210,1755,1254,2011-06-06T06:47:23,1307342843,scraping,1,,,,,,,,,2021-11-19T07:16:23.857394,https://twitter.com/Etalab/statuses/1442799548619968512,,,,,https://www.etalab.gouv.fr/publication-du-rapport-dinum-insee-12-recommandations-pour-dynamiser-la-gestion-et-la-valorisation-des-competences-data,etalab.gouv.fr,https://pbs.twimg.com/media/FAXaJt_WEAIbyHz.png,1442799548619968512_FAXaJt_WEAIbyHz.png,photo,_dinum|inseefr,4910809053|217473382,compétences|data,,,
from:@etalab,1442507258060025858,1632755505,2021-09-27T15:11:45,Etalab,"🙏Merci à tous les administrateurs et administratrices ministériel(le)s des données (nommés le 15 mai dernier), qui portent ces politiques et mobilisent les services dans leur ministère, et sans qui ce travail n'aurait été possible https://twitter.com/Etalab/status/1442507258060025858/photo/1",0,11,28,0,fr,Etalab,311880926,1442503261601341444,Twitter Web App,https://mobile.twitter.com,France,,,311880926,Etalab,1,Service du Premier ministre qui met à disposition et utilise les données pour améliorer l’action publique. L’équipe derrière @datagouvfr et @eigforever.,http://www.etalab.gouv.fr,https://pbs.twimg.com/profile_images/1067688380111171584/2ZRwOuxE_normal.jpg,4817,32950,210,1755,1254,2011-06-06T06:47:23,1307342843,scraping,1,,,,,,,,,2021-11-19T07:16:23.857943,https://twitter.com/Etalab/statuses/1442507258060025858,,,,,,,https://pbs.twimg.com/media/FATPDEIXIAAnOG7.jpg|https://pbs.twimg.com/media/FATPITXVEAIe_cM.jpg,1442507258060025858_FATPDEIXIAAnOG7.jpg|1442507258060025858_FATPITXVEAIe_cM.jpg,photo|photo,,,,,,
from:@etalab,1442503261601341444,1632754552,2021-09-27T14:55:52,Etalab,"Sur chaque périmètre ministériel, chacune de ces stratégies met en lumière :
✨ce que la donnée peut améliorer dans les politiques publiques
🎯les actions à mener 
🗓️ leur calendrier de réalisation et la gouvernance mise en place pour en assurer la mise en œuvre",,2,7,1,fr,Etalab,311880926,1442501552959275010,Twitter Web App,https://mobile.twitter.com,France,,,311880926,Etalab,1,Service du Premier ministre qui met à disposition et utilise les données pour améliorer l’action publique. L’équipe derrière @datagouvfr et @eigforever.,http://www.etalab.gouv.fr,https://pbs.twimg.com/profile_images/1067688380111171584/2ZRwOuxE_normal.jpg,4817,32950,210,1755,1254,2011-06-06T06:47:23,1307342843,scraping,1,,,,,,,,,2021-11-19T07:16:23.858226,https://twitter.com/Etalab/statuses/1442503261601341444,,,,,,,,,,,,,,,
from:@etalab,1442501552959275010,1632754145,2021-09-27T14:49:05,Etalab,"En cinq mois et dans une mobilisation sans précédent, chaque ministère a élaboré une feuille de route sur deux à trois ans :
« datagouvfr: Politique de la donnée, des algorithmes et des codes sources : sur @datagouvfr, les feuilles de route dévoilées ce matin par @AdeMontchalin  
▶️ Les 15 feuilles de route ministérielles : https://www.data.gouv.fr/fr/datasets/politique-publique-de-la-donnee-des-algorithmes-et-des-codes-sources-15-feuilles-de-route-ministerielles/
▶️ La liste complète des 500 actions : https://www.data.gouv.fr/fr/datasets/liste-des-actions-prises-par-les-ministeres-dans-le-cadre-des-feuilles-de-routes-ministerielles/ — https://twitter.com/datagouvfr/status/1442500508946554885?s=20 »",0,2,9,1,fr,Etalab,311880926,1442497913729556483,Twitter Web App,https://mobile.twitter.com,France,,,311880926,Etalab,1,Service du Premier ministre qui met à disposition et utilise les données pour améliorer l’action publique. L’équipe derrière @datagouvfr et @eigforever.,http://www.etalab.gouv.fr,https://pbs.twimg.com/profile_images/1067688380111171584/2ZRwOuxE_normal.jpg,4817,32950,210,1755,1254,2011-06-06T06:47:23,1307342843,scraping,1,,,,,1442500508946554885,datagouvfr,268227446,1632753896,2021-11-19T07:16:23.859058,https://twitter.com/Etalab/statuses/1442501552959275010,,,,,https://twitter.com/datagouvfr/status/1442500508946554885|https://www.data.gouv.fr/fr/datasets/liste-des-actions-prises-par-les-ministeres-dans-le-cadre-des-feuilles-de-routes-ministerielles/|https://www.data.gouv.fr/fr/datasets/politique-publique-de-la-donnee-des-algorithmes-et-des-codes-sources-15-feuilles-de-route-ministerielles/,twitter.com|data.gouv.fr|data.gouv.fr,,,,ademontchalin|datagouvfr,800435764966215680|268227446,,,,
from:@etalab,1442497913729556483,1632753277,2021-09-27T14:34:37,Etalab,"[Fil] Politique de la donnée, des algorithmes et des codes sources : 15 stratégies ministérielles & 500 actions pr accélérer🚀
Ce matin, @AdeMontchalin a dévoilé @IGNFrance en présence des Administrateurs ministériels des données les 15 feuilles de route 
https://www.etalab.gouv.fr/politique-de-la-donnee-des-algorithmes-et-des-codes-sources-15-strategies-ministerielles-et-500-actions-pour-accelerer https://twitter.com/Etalab/status/1442497913729556483/photo/1",0,31,72,4,fr,,,,Twitter Web App,https://mobile.twitter.com,France,,,311880926,Etalab,1,Service du Premier ministre qui met à disposition et utilise les données pour améliorer l’action publique. L’équipe derrière @datagouvfr et @eigforever.,http://www.etalab.gouv.fr,https://pbs.twimg.com/profile_images/1067688380111171584/2ZRwOuxE_normal.jpg,4817,32950,210,1755,1254,2011-06-06T06:47:23,1307342843,scraping,1,,,,,,,,,2021-11-19T07:16:23.859547,https://twitter.com/Etalab/statuses/1442497913729556483,,,,,https://www.etalab.gouv.fr/politique-de-la-donnee-des-algorithmes-et-des-codes-sources-15-strategies-ministerielles-et-500-actions-pour-accelerer,etalab.gouv.fr,https://pbs.twimg.com/media/FATHGvVXMAERDUa.jpg,1442497913729556483_FATHGvVXMAERDUa.jpg,photo,ademontchalin|ignfrance,800435764966215680|57276576,,,,
from:@etalab,1435620313006546956,1631113529,2021-09-08T15:05:29,Etalab,"Mettre la recherche en IA au service de la transformation publique, c'est l'objectif de l'accompagnement recherche du Lab IA. 

Découvrez l'appel à projets : https://www.etalab.gouv.fr/administrations-candidatez-a-laccompagnement-recherche-du-lab-ia

Deadline au 9 octobre.",0,12,17,0,fr,,,,Twitter Web App,https://mobile.twitter.com,France,,,311880926,Etalab,1,Service du Premier ministre qui met à disposition et utilise les données pour améliorer l’action publique. L’équipe derrière @datagouvfr et @eigforever.,http://www.etalab.gouv.fr,https://pbs.twimg.com/profile_images/1067688380111171584/2ZRwOuxE_normal.jpg,4817,32950,210,1755,1254,2011-06-06T06:47:23,1307342843,scraping,1,,,,,,,,,2021-11-19T07:16:23.859878,https://twitter.com/Etalab/statuses/1435620313006546956,,,,,https://www.etalab.gouv.fr/administrations-candidatez-a-laccompagnement-recherche-du-lab-ia,etalab.gouv.fr,,,,,,,,,
from:@etalab,1423301141690036227,1628176410,2021-08-05T15:13:30,Etalab,#OpenData #OpenSource,,11,12,0,und,,,,Twitter Web App,https://mobile.twitter.com,France,,,311880926,Etalab,1,Service du Premier ministre qui met à disposition et utilise les données pour améliorer l’action publique. L’équipe derrière @datagouvfr et @eigforever.,http://www.etalab.gouv.fr,https://pbs.twimg.com/profile_images/1067688380111171584/2ZRwOuxE_normal.jpg,4817,32950,210,1755,1254,2011-06-06T06:47:23,1307342843,scraping,1,,,,,1423300730677571586,datagouvfr,268227446,1628176312,2021-11-19T07:16:23.860679,https://twitter.com/Etalab/statuses/1423301141690036227,,,,,http://ouverture.data.gouv.fr|https://ouverture.data.gouv.fr,ouverture.data.gouv.fr|ouverture.data.gouv.fr,https://pbs.twimg.com/media/E8CUYC8WEAAEyBg.jpg,1423300730677571586_E8CUYC8WEAAEyBg.jpg,photo,,,opendata|opensource,,,
from:@etalab,1419685315799879686,1627314330,2021-07-26T15:45:30,Etalab,"🎉La promotion 5 d'Entrepreneurs d'Intérêt Général est constituée !

Découvrez les 39 talents du numérique qui intégreront l'administration en septembre. 

Profils des EIG, défis à relever et chiffres de la promo, tout est là👉https://www.etalab.gouv.fr/entrepreneurs-dinteret-general-laureats-et-defis-de-la-5eme-promotion

cc @eigforever @_DINUM https://twitter.com/Etalab/status/1419685315799879686/photo/1",0,16,37,1,fr,,,,Twitter Web App,https://mobile.twitter.com,France,,,311880926,Etalab,1,Service du Premier ministre qui met à disposition et utilise les données pour améliorer l’action publique. L’équipe derrière @datagouvfr et @eigforever.,http://www.etalab.gouv.fr,https://pbs.twimg.com/profile_images/1067688380111171584/2ZRwOuxE_normal.jpg,4817,32950,210,1755,1254,2011-06-06T06:47:23,1307342843,scraping,1,,,,,,,,,2021-11-19T07:16:23.861162,https://twitter.com/Etalab/statuses/1419685315799879686,,,,,https://www.etalab.gouv.fr/entrepreneurs-dinteret-general-laureats-et-defis-de-la-5eme-promotion,etalab.gouv.fr,https://pbs.twimg.com/media/E7O8ISHXoAEdGz9.jpg,1419685315799879686_E7O8ISHXoAEdGz9.jpg,photo,_dinum|eigforever,4910809053|959462629407379456,,,,
from:@etalab,1417144265273188354,1626708496,2021-07-19T15:28:16,Etalab,"[#DemoDay virtuel] Voici ce que la promotion Entrepreneurs d'Intérêt Général 4 a réalisé en 10 mois !

Découvrez leur démarche et testez leurs outils👉https://www.etalab.gouv.fr/decouvrez-les-realisations-de-la-promotion-4-du-programme-entrepreneurs-dinteret-general https://twitter.com/Etalab/status/1417144265273188354/photo/1",0,5,4,0,fr,,,,Twitter Web App,https://mobile.twitter.com,France,,,311880926,Etalab,1,Service du Premier ministre qui met à disposition et utilise les données pour améliorer l’action publique. L’équipe derrière @datagouvfr et @eigforever.,http://www.etalab.gouv.fr,https://pbs.twimg.com/profile_images/1067688380111171584/2ZRwOuxE_normal.jpg,4817,32950,210,1755,1254,2011-06-06T06:47:23,1307342843,scraping,1,,,,,,,,,2021-11-19T07:16:23.861605,https://twitter.com/Etalab/statuses/1417144265273188354,,,,,https://www.etalab.gouv.fr/decouvrez-les-realisations-de-la-promotion-4-du-programme-entrepreneurs-dinteret-general,etalab.gouv.fr,https://pbs.twimg.com/media/E6q0M3uXoAweIg9.jpg,1417144265273188354_E6q0M3uXoAweIg9.jpg,photo,,,demoday,,,
from:@etalab,1415606017950367746,1626341750,2021-07-15T09:35:50,Etalab,"@QuadrantConseil @emile_marzolf Hi, thank you for the shoutout! We plan to release insights in English soon (around September).",,0,1,0,en,QuadrantConseil,914024138687344640,1415581872730558465,Twitter Web App,https://mobile.twitter.com,France,,,311880926,Etalab,1,Service du Premier ministre qui met à disposition et utilise les données pour améliorer l’action publique. L’équipe derrière @datagouvfr et @eigforever.,http://www.etalab.gouv.fr,https://pbs.twimg.com/profile_images/1067688380111171584/2ZRwOuxE_normal.jpg,4817,32950,210,1755,1254,2011-06-06T06:47:23,1307342843,scraping,1,,,,,,,,,2021-11-19T07:16:23.861854,https://twitter.com/Etalab/statuses/1415606017950367746,,,,,,,,,,emile_marzolf|quadrantconseil,3579836002|914024138687344640,,,,
from:@etalab,1415605812937043971,1626341701,2021-07-15T09:35:01,Etalab,"6/n We want to thank everyone who took part in this study, especially those who accepted to be interviewed! Insights in English to come soon.

Merci à toutes les personnes qui ont accepté de réaliser des entretiens à cette occasion ! Une synthèse en anglais est à venir.",,0,2,0,fr,Etalab,311880926,1415605811041210368,Twitter Web App,https://mobile.twitter.com,France,,,311880926,Etalab,1,Service du Premier ministre qui met à disposition et utilise les données pour améliorer l’action publique. L’équipe derrière @datagouvfr et @eigforever.,http://www.etalab.gouv.fr,https://pbs.twimg.com/profile_images/1067688380111171584/2ZRwOuxE_normal.jpg,4817,32950,210,1755,1254,2011-06-06T06:47:23,1307342843,scraping,1,,,,,,,,,2021-11-19T07:16:23.862126,https://twitter.com/Etalab/statuses/1415605812937043971,,,,,,,,,,,,,,,
from:@etalab,1415605811041210368,1626341700,2021-07-15T09:35:00,Etalab,"5/n En bonus, retrouvez le webinaire de lancement avec les témoignages de @ElodieQuzel (Signaux Faibles), @hubertguillaud (@InternetActu) et @MrDeshaies (@sct_canada)

👉 https://www.dailymotion.com/video/x82n2og https://twitter.com/Etalab/status/1415605811041210368/photo/1",0,0,4,1,fr,Etalab,311880926,1415605805064331264,Twitter Web App,https://mobile.twitter.com,France,,,311880926,Etalab,1,Service du Premier ministre qui met à disposition et utilise les données pour améliorer l’action publique. L’équipe derrière @datagouvfr et @eigforever.,http://www.etalab.gouv.fr,https://pbs.twimg.com/profile_images/1067688380111171584/2ZRwOuxE_normal.jpg,4817,32950,210,1755,1254,2011-06-06T06:47:23,1307342843,scraping,1,,,,,,,,,2021-11-19T07:16:23.862595,https://twitter.com/Etalab/statuses/1415605811041210368,,,,,https://www.dailymotion.com/video/x82n2og,dailymotion.com,https://pbs.twimg.com/media/E6U9K7YXIAI00rg.jpg,1415605811041210368_E6U9K7YXIAI00rg.jpg,photo,elodiequzel|hubertguillaud|internetactu|mrdeshaies|sct_canada,2199596635|621073|13046422|1151113494529548288|429085231,,,,
from:@etalab,1415605805064331264,1626341699,2021-07-15T09:34:59,Etalab,"4/n 2 questions discutées dans l'étude: 
1️⃣ Qui utilise ces outils ? Pour quels usages ?
2️⃣ Qui évalue les impacts ?",,0,2,1,fr,Etalab,311880926,1415605803436986369,Twitter Web App,https://mobile.twitter.com,France,,,311880926,Etalab,1,Service du Premier ministre qui met à disposition et utilise les données pour améliorer l’action publique. L’équipe derrière @datagouvfr et @eigforever.,http://www.etalab.gouv.fr,https://pbs.twimg.com/profile_images/1067688380111171584/2ZRwOuxE_normal.jpg,4817,32950,210,1755,1254,2011-06-06T06:47:23,1307342843,scraping,1,,,,,,,,,2021-11-19T07:16:24.265160,https://twitter.com/Etalab/statuses/1415605805064331264,,,,,,,,,,,,,,,
from:@etalab,1415605803436986369,1626341698,2021-07-15T09:34:58,Etalab,"3/n Des outils aux formes variées: cadre de bonnes pratiques, liste de questions, matrice de risques, calcul de risques... https://twitter.com/Etalab/status/1415605803436986369/photo/1",0,1,3,1,fr,Etalab,311880926,1415605800962297856,Twitter Web App,https://mobile.twitter.com,France,,,311880926,Etalab,1,Service du Premier ministre qui met à disposition et utilise les données pour améliorer l’action publique. L’équipe derrière @datagouvfr et @eigforever.,http://www.etalab.gouv.fr,https://pbs.twimg.com/profile_images/1067688380111171584/2ZRwOuxE_normal.jpg,4817,32950,210,1755,1254,2011-06-06T06:47:23,1307342843,scraping,1,,,,,,,,,2021-11-19T07:16:24.265602,https://twitter.com/Etalab/statuses/1415605803436986369,,,,,,,https://pbs.twimg.com/media/E6U82yCWYAEXW3B.jpg,1415605803436986369_E6U82yCWYAEXW3B.jpg,photo,,,,,,
from:@etalab,1415605800962297856,1626341698,2021-07-15T09:34:58,Etalab,2/n L’étude inclut 7 outils développés notamment par @Stats_NZ  @SCT_Canada  @GDSTeam  @AINowInstitute https://twitter.com/Etalab/status/1415605800962297856/photo/1,0,0,4,1,fr,Etalab,311880926,1415605798735069184,Twitter Web App,https://mobile.twitter.com,France,,,311880926,Etalab,1,Service du Premier ministre qui met à disposition et utilise les données pour améliorer l’action publique. L’équipe derrière @datagouvfr et @eigforever.,http://www.etalab.gouv.fr,https://pbs.twimg.com/profile_images/1067688380111171584/2ZRwOuxE_normal.jpg,4817,32950,210,1755,1254,2011-06-06T06:47:23,1307342843,scraping,1,,,,,,,,,2021-11-19T07:16:24.266027,https://twitter.com/Etalab/statuses/1415605800962297856,,,,,,,https://pbs.twimg.com/media/E6U8j2VWUAIba7p.jpg,1415605800962297856_E6U8j2VWUAIba7p.jpg,photo,ainowinstitute|gdsteam|sct_canada|stats_nz,840618056678293504|268349503|429085231|56802117,,,,
