query,id,timestamp_utc,local_time,user_screen_name,text,possibly_sensitive,retweet_count,like_count,reply_count,lang,to_username,to_userid,to_tweetid,source_name,source_url,user_location,lat,lng,user_id,user_name,user_verified,user_description,user_url,user_image,user_tweets,user_followers,user_friends,user_likes,user_lists,user_created_at,user_timestamp_utc,collected_via,match_query,retweeted_id,retweeted_user,retweeted_user_id,retweeted_timestamp_utc,quoted_id,quoted_user,quoted_user_id,quoted_timestamp_utc,collection_time,url,place_country_code,place_name,place_type,place_coordinates,links,domains,media_urls,media_files,media_types,mentioned_names,mentioned_ids,hashtags,intervention_type,intervention_text,intervention_url
from:@etalab,1408311377597509634,1624602572,2021-06-25T06:29:32,Etalab,"Quand mettre en place des algorithmes dans le secteur public ? Quels outils de médiation pour en discuter ? Comment les outils du design fiction nous aident à penser les enjeux d'aujourd'hui en parlant de demain ? 
Ca commence dans 30 minutes !",,8,14,1,fr,,,,Twitter Web App,https://mobile.twitter.com,France,,,311880926,Etalab,1,Service du Premier ministre qui met à disposition et utilise les données pour améliorer l’action publique. L’équipe derrière @datagouvfr et @eigforever.,http://www.etalab.gouv.fr,https://pbs.twimg.com/profile_images/1067688380111171584/2ZRwOuxE_normal.jpg,4817,32950,210,1755,1254,2011-06-06T06:47:23,1307342843,scraping,1,,,,,1407362890605137928,Etalab,311880926,1624376435,2021-11-19T07:16:24.599135,https://twitter.com/Etalab/statuses/1408311377597509634,,,,,https://app.livestorm.co/dinum-12/algorithmes-publics-and-design-speculatif-restitution-des-travaux-detalab-et-de-design-friction?type=detailed,app.livestorm.co,https://pbs.twimg.com/media/E4f0jtCWEAAqZ7a.jpg,1407362890605137928_E4f0jtCWEAAqZ7a.jpg,photo,design_friction,2853425710,algorithmes|design,,,
from:@etalab,1408046595401191431,1624539443,2021-06-24T12:57:23,Etalab,"""La donnée pr produire un meilleur service public, transformer en profondeur, piloter par les résultats"" 
🚀@AdeMontchalin clôture le 1er Conseil Interministériel des Administrateurs de la Donnée, qui réunit les 18 AMD https://www.data.gouv.fr/fr/datasets/liste-des-administrateurs-ministeriels-des-donnees/ sous la présidence de l'AGDAC @_DINUM https://twitter.com/Etalab/status/1408046595401191431/photo/1",0,19,53,3,fr,,,,Twitter Web App,https://mobile.twitter.com,France,,,311880926,Etalab,1,Service du Premier ministre qui met à disposition et utilise les données pour améliorer l’action publique. L’équipe derrière @datagouvfr et @eigforever.,http://www.etalab.gouv.fr,https://pbs.twimg.com/profile_images/1067688380111171584/2ZRwOuxE_normal.jpg,4817,32950,210,1755,1254,2011-06-06T06:47:23,1307342843,scraping,1,,,,,,,,,2021-11-19T07:16:24.599736,https://twitter.com/Etalab/statuses/1408046595401191431,,,,,https://www.data.gouv.fr/fr/datasets/liste-des-administrateurs-ministeriels-des-donnees/,data.gouv.fr,https://pbs.twimg.com/media/E4pcemlXoAYz1Tv.jpg|https://pbs.twimg.com/media/E4pcfhfXwAA8Baf.jpg,1408046595401191431_E4pcemlXoAYz1Tv.jpg|1408046595401191431_E4pcfhfXwAA8Baf.jpg,photo|photo,_dinum|ademontchalin,4910809053|800435764966215680,,,,
from:@etalab,1408035531703914501,1624536805,2021-06-24T12:13:25,Etalab,"[RECRUTEMENT] Etalab étoffe son équipe dédiée aux #logiciels #libres 🧢 !  

Nous cherchons une personne en apprentissage communication et événementiel et une autre en contrat à temps plein chargée de la valorisation des
logiciels libres :

https://www.etalab.gouv.fr/etalab-renforce-ses-effectifs-dedies-aux-logiciels-libres",0,49,29,0,fr,,,,Twitter Web App,https://mobile.twitter.com,France,,,311880926,Etalab,1,Service du Premier ministre qui met à disposition et utilise les données pour améliorer l’action publique. L’équipe derrière @datagouvfr et @eigforever.,http://www.etalab.gouv.fr,https://pbs.twimg.com/profile_images/1067688380111171584/2ZRwOuxE_normal.jpg,4817,32950,210,1755,1254,2011-06-06T06:47:23,1307342843,scraping,1,,,,,,,,,2021-11-19T07:16:24.600055,https://twitter.com/Etalab/statuses/1408035531703914501,,,,,https://www.etalab.gouv.fr/etalab-renforce-ses-effectifs-dedies-aux-logiciels-libres,etalab.gouv.fr,,,,,,libres|logiciels,,,
from:@etalab,1407362890605137928,1624376435,2021-06-22T15:40:35,Etalab,"Quels enjeux autour des #algorithmes publics ? Comment dialoguer autour de ces systèmes parfois opaques ?

Avec @Design_Friction, Etalab a exploré ces questions à l'aide du #design spéculatif. 

Restitution des travaux vendredi 26/06 de 9h à 10h30 ! 🗓️

👉 https://app.livestorm.co/dinum-12/algorithmes-publics-and-design-speculatif-restitution-des-travaux-detalab-et-de-design-friction?type=detailed https://twitter.com/Etalab/status/1407362890605137928/photo/1",0,27,43,3,fr,,,,Twitter Web App,https://mobile.twitter.com,France,,,311880926,Etalab,1,Service du Premier ministre qui met à disposition et utilise les données pour améliorer l’action publique. L’équipe derrière @datagouvfr et @eigforever.,http://www.etalab.gouv.fr,https://pbs.twimg.com/profile_images/1067688380111171584/2ZRwOuxE_normal.jpg,4817,32950,210,1755,1254,2011-06-06T06:47:23,1307342843,scraping,1,,,,,,,,,2021-11-19T07:16:24.600487,https://twitter.com/Etalab/statuses/1407362890605137928,,,,,https://app.livestorm.co/dinum-12/algorithmes-publics-and-design-speculatif-restitution-des-travaux-detalab-et-de-design-friction?type=detailed,app.livestorm.co,https://pbs.twimg.com/media/E4f0jtCWEAAqZ7a.jpg,1407362890605137928_E4f0jtCWEAAqZ7a.jpg,photo,design_friction,2853425710,algorithmes|design,,,
from:@etalab,1405531844167180298,1623939879,2021-06-17T14:24:39,Etalab,"Venez découvrir les résultats de la promotion 4 d'@eigforever, avec un plan A et un plan B plus #lowtech !

@_DINUM @_DITP @AssoFP21 @design_gouv @BetaGouv @MissionSoNum @laurelucchesi @RomainTales @pa_chevalier @mariejulien",,2,9,1,fr,,,,Twitter Web App,https://mobile.twitter.com,France,,,311880926,Etalab,1,Service du Premier ministre qui met à disposition et utilise les données pour améliorer l’action publique. L’équipe derrière @datagouvfr et @eigforever.,http://www.etalab.gouv.fr,https://pbs.twimg.com/profile_images/1067688380111171584/2ZRwOuxE_normal.jpg,4817,32950,210,1755,1254,2011-06-06T06:47:23,1307342843,scraping,1,,,,,1405530802838859780,eigforever,959462629407379456,1623939631,2021-11-19T07:16:24.601436,https://twitter.com/Etalab/statuses/1405531844167180298,,,,,https://bit.ly/35qLYzI|https://bit.ly/35uz3g6,bit.ly|bit.ly,https://pbs.twimg.com/media/E4FyuVoUcAMdmYs.jpg,1405530802838859780_E4FyuVoUcAMdmYs.jpg,photo,_dinum|_ditp|assofp21|betagouv|design_gouv|eigforever|laurelucchesi|mariejulien|missionsonum|pa_chevalier|romaintales,4910809053|159161738|833384094310477824|715451644683673601|1150678703728463872|959462629407379456|71759599|178739367|93966147|760222838|376302887,lowtech,,,
from:@etalab,1404772418552479744,1623758818,2021-06-15T12:06:58,Etalab,"[#Recrutement] Nous cherchons un ou une chargé(e) de développement pour le Lab IA. 

Découvrez l'annonce : https://www.etalab.gouv.fr/le-lab-ia-recrute-son-charge-de-developpement https://twitter.com/Etalab/status/1404772418552479744/photo/1",0,12,14,0,fr,,,,TweetDeck,https://about.twitter.com/products/tweetdeck,France,,,311880926,Etalab,1,Service du Premier ministre qui met à disposition et utilise les données pour améliorer l’action publique. L’équipe derrière @datagouvfr et @eigforever.,http://www.etalab.gouv.fr,https://pbs.twimg.com/profile_images/1067688380111171584/2ZRwOuxE_normal.jpg,4817,32950,210,1755,1254,2011-06-06T06:47:23,1307342843,scraping,1,,,,,,,,,2021-11-19T07:16:24.601880,https://twitter.com/Etalab/statuses/1404772418552479744,,,,,https://www.etalab.gouv.fr/le-lab-ia-recrute-son-charge-de-developpement,etalab.gouv.fr,https://pbs.twimg.com/media/E37Ag0PWEAYGtIM.jpg,1404772418552479744_E37Ag0PWEAYGtIM.jpg,photo,,,recrutement,,,
from:@etalab,1404701980166180867,1623742024,2021-06-15T07:27:04,Etalab,"📢J-2 avant le DemoDay final de la promotion Entrepreneurs d'Intérêt Général n°4 !

Au programme : 2 tables rondes, dont 1 internationale, une exposition virtuelle et des temps de rencontre avec les équipes.

📅17 juin - 14h
Inscrivez-vous👉https://bit.ly/DemoDayEIG4 https://twitter.com/Etalab/status/1404701980166180867/photo/1",0,4,9,1,fr,,,,Twitter Web App,https://mobile.twitter.com,France,,,311880926,Etalab,1,Service du Premier ministre qui met à disposition et utilise les données pour améliorer l’action publique. L’équipe derrière @datagouvfr et @eigforever.,http://www.etalab.gouv.fr,https://pbs.twimg.com/profile_images/1067688380111171584/2ZRwOuxE_normal.jpg,4817,32950,210,1755,1254,2011-06-06T06:47:23,1307342843,scraping,1,,,,,,,,,2021-11-19T07:16:24.602353,https://twitter.com/Etalab/statuses/1404701980166180867,,,,,https://bit.ly/DemoDayEIG4,bit.ly,https://pbs.twimg.com/media/E35_UwTWEAI50Z7.jpg,1404701980166180867_E35_UwTWEAI50Z7.jpg,photo,,,,,,
from:@etalab,1402280480335138819,1623164694,2021-06-08T15:04:54,Etalab,"Evaluer les impacts des #algorithmes: quels outils ? pour quels résultats ?
Venez échanger sur le sujet à l'occasion de la publication d'une étude internationale réalisée par @el_lehagre !

En ligne📍
Lundi 14/06, 16h-17h30 🗓️
https://app.livestorm.co/dinum-12/levaluation-des-impacts-algorithmiques-quels-outils-pour-quels-resultats?type=detailed",0,3,6,0,fr,,,,Twitter Web App,https://mobile.twitter.com,France,,,311880926,Etalab,1,Service du Premier ministre qui met à disposition et utilise les données pour améliorer l’action publique. L’équipe derrière @datagouvfr et @eigforever.,http://www.etalab.gouv.fr,https://pbs.twimg.com/profile_images/1067688380111171584/2ZRwOuxE_normal.jpg,4817,32950,210,1755,1254,2011-06-06T06:47:23,1307342843,scraping,1,,,,,,,,,2021-11-19T07:16:24.602658,https://twitter.com/Etalab/statuses/1402280480335138819,,,,,https://app.livestorm.co/dinum-12/levaluation-des-impacts-algorithmiques-quels-outils-pour-quels-resultats?type=detailed,app.livestorm.co,,,,el_lehagre,1339491930,algorithmes,,,
from:@etalab,1402156412172746752,1623135114,2021-06-08T06:51:54,Etalab,"2⃣@algorithmwatch (@spielkamp), @divijualsuspect and Etalab (@schignard + @soizicpenicaud) will host a strategy session #RightsCon.

Come strategize and network around public sector algo registers!

🗓️ Thursday 13:15 CEST

➡️ https://s.42l.fr/algoregisters https://twitter.com/Etalab/status/1402156412172746752/photo/1",0,6,4,0,en,Etalab,311880926,1402156408146214913,Twitter Web App,https://mobile.twitter.com,France,,,311880926,Etalab,1,Service du Premier ministre qui met à disposition et utilise les données pour améliorer l’action publique. L’équipe derrière @datagouvfr et @eigforever.,http://www.etalab.gouv.fr,https://pbs.twimg.com/profile_images/1067688380111171584/2ZRwOuxE_normal.jpg,4817,32950,210,1755,1254,2011-06-06T06:47:23,1307342843,scraping,1,,,,,,,,,2021-11-19T07:16:24.603100,https://twitter.com/Etalab/statuses/1402156412172746752,,,,,https://s.42l.fr/algoregisters,s.42l.fr,https://pbs.twimg.com/media/E3V1SypX0AMzPlQ.jpg,1402156412172746752_E3V1SypX0AMzPlQ.jpg,photo,algorithmwatch|divijualsuspect|schignard|soizicpenicaud|spielkamp,4316593949|3509452832|124512591|62055977|15441119,rightscon,,,
from:@etalab,1402156408146214913,1623135113,2021-06-08T06:51:53,Etalab,"Find Etalab at 2 #RightsCon events this year! 

1⃣In less than 2 hours, @soizicpenicaud will discuss algorithmic accountability & participation w/ @TonuBasu @Fscrollini @NaDomagala @ambaonadventure, Laurence Millar&Eleisha Hawkins. @opengovpart @rightscon 

🗓️ TODAY 10:15 CEST",,2,2,1,en,,,,Twitter Web App,https://mobile.twitter.com,France,,,311880926,Etalab,1,Service du Premier ministre qui met à disposition et utilise les données pour améliorer l’action publique. L’équipe derrière @datagouvfr et @eigforever.,http://www.etalab.gouv.fr,https://pbs.twimg.com/profile_images/1067688380111171584/2ZRwOuxE_normal.jpg,4817,32950,210,1755,1254,2011-06-06T06:47:23,1307342843,scraping,1,,,,,1401900027044413442,opengovpart,321575853,1623073987,2021-11-19T07:16:24.603866,https://twitter.com/Etalab/statuses/1402156408146214913,,,,,https://bit.ly/3ibimhi,bit.ly,https://pbs.twimg.com/media/E3SK97AXwAQ1zCF.jpg,1401900027044413442_E3SK97AXwAQ1zCF.jpg,photo,ambaonadventure|fscrollini|nadomagala|opengovpart|rightscon|soizicpenicaud|tonubasu,801013588324274176|216335805|2821393265|321575853|353510815|62055977|258842582,opengov|rightscon,,,
from:@etalab,1402147546051579904,1623133000,2021-06-08T06:16:40,Etalab,"[⏰J-7] Le Demo Day final de la promotion 4 du programme Entrepreneurs d'Intérêt Général, c'est la semaine prochaine ! 

Les 17 équipes vous feront un retour d'expérience sur leurs projets. 

📅17 juin - 14h 
Programme détaillé et inscription👉http://bit.ly/DemoDayEIG4 https://twitter.com/Etalab/status/1402147546051579904/photo/1",0,3,4,1,fr,,,,Twitter Web App,https://mobile.twitter.com,France,,,311880926,Etalab,1,Service du Premier ministre qui met à disposition et utilise les données pour améliorer l’action publique. L’équipe derrière @datagouvfr et @eigforever.,http://www.etalab.gouv.fr,https://pbs.twimg.com/profile_images/1067688380111171584/2ZRwOuxE_normal.jpg,4817,32950,210,1755,1254,2011-06-06T06:47:23,1307342843,scraping,1,,,,,,,,,2021-11-19T07:16:24.604329,https://twitter.com/Etalab/statuses/1402147546051579904,,,,,http://bit.ly/DemoDayEIG4,bit.ly,https://pbs.twimg.com/media/E3VswZNXEAUmcUW.jpg,1402147546051579904_E3VswZNXEAUmcUW.jpg,photo,,,,,,
from:@etalab,1400060536335880200,1622635418,2021-06-02T12:03:38,Etalab,"[📢Evénement] Comment se sont déroulés les 10 mois de la promotion 4 du programme Entrepreneurs d'Intérêt Général ? 

Participez au DemoDay final pour découvrir leurs réalisations et retours d'expérience !

📅17/06 - 14h 
Inscription👉https://bit.ly/DemoDayEIG4 https://twitter.com/Etalab/status/1400060536335880200/photo/1",0,12,13,0,fr,,,,Twitter Web App,https://mobile.twitter.com,France,,,311880926,Etalab,1,Service du Premier ministre qui met à disposition et utilise les données pour améliorer l’action publique. L’équipe derrière @datagouvfr et @eigforever.,http://www.etalab.gouv.fr,https://pbs.twimg.com/profile_images/1067688380111171584/2ZRwOuxE_normal.jpg,4817,32950,210,1755,1254,2011-06-06T06:47:23,1307342843,scraping,1,,,,,,,,,2021-11-19T07:16:24.604790,https://twitter.com/Etalab/statuses/1400060536335880200,,,,,https://bit.ly/DemoDayEIG4,bit.ly,https://pbs.twimg.com/media/E24Bh21WEAIpl2L.jpg,1400060536335880200_E24Bh21WEAIpl2L.jpg,photo,,,,,,
from:@etalab,1395681810072444928,1621591448,2021-05-21T10:04:08,Etalab,Etalab vous invite à cet événement co-organisé avec @wikimedia_fr : faisons progresser les communs numériques culturels ensemble !,,28,45,1,fr,,,,Twitter Web App,https://mobile.twitter.com,France,,,311880926,Etalab,1,Service du Premier ministre qui met à disposition et utilise les données pour améliorer l’action publique. L’équipe derrière @datagouvfr et @eigforever.,http://www.etalab.gouv.fr,https://pbs.twimg.com/profile_images/1067688380111171584/2ZRwOuxE_normal.jpg,4817,32950,210,1755,1254,2011-06-06T06:47:23,1307342843,scraping,1,,,,,1395399382162366467,Wikimedia_Fr,17271765,1621524112,2021-11-19T07:16:24.605365,https://twitter.com/Etalab/statuses/1395681810072444928,,,,,https://bit.ly/3f9p7hT,bit.ly,,,,etalab|ministerecc|wikimedia_fr,311880926|822984456|17271765,glamwiki|linkeddata|wikidata,,,
from:@etalab,1395075396111056897,1621446868,2021-05-19T17:54:28,Etalab,"👥 En application de la circulaire du Premier ministre, les Administrateurs Ministériels des Données ont été designés dans chq ministère
Ils y portent l'ouverture, la circulation, l'exploitation des données, algo & codes sources
➡️ https://www.data.gouv.fr/fr/datasets/liste-des-administrateurs-ministeriels-des-donnees/ @AdeMontchalin  @_DINUM",0,54,85,1,fr,,,,Twitter Web App,https://mobile.twitter.com,France,,,311880926,Etalab,1,Service du Premier ministre qui met à disposition et utilise les données pour améliorer l’action publique. L’équipe derrière @datagouvfr et @eigforever.,http://www.etalab.gouv.fr,https://pbs.twimg.com/profile_images/1067688380111171584/2ZRwOuxE_normal.jpg,4817,32950,210,1755,1254,2011-06-06T06:47:23,1307342843,scraping,1,,,,,,,,,2021-11-19T07:16:24.605696,https://twitter.com/Etalab/statuses/1395075396111056897,,,,,https://www.data.gouv.fr/fr/datasets/liste-des-administrateurs-ministeriels-des-donnees/,data.gouv.fr,,,,_dinum|ademontchalin,4910809053|800435764966215680,,,,
from:@etalab,1394310221464494081,1621264436,2021-05-17T15:13:56,Etalab,"Et si le sujet des algorithmes publics vous intéresse et que vous avez envie d'une introduction accessible :

🗓️ Rendez-vous ce vendredi à 9h30 pour le 6e #MicroOuvert de la @_DITP avec @schignard et @soizicpenicaud !

« _DITP: La @_DITP vous donne RDV le 21 mai à 9h30 pour son 6ème #MicroOuvert avec @soizicpenicaud et @schignard de chez @Etalab. On va parler ouverture des #algorithmes et #accessibilité des codes sources publics ! #GouvernementOuvert
http://bit.ly/Mic_ouvert6 https://twitter.com/_DITP/status/1392475827850424323/photo/1 — https://twitter.com/_DITP/status/1392475827850424323 »",0,3,3,0,fr,Etalab,311880926,1394310218213888004,Twitter Web App,https://mobile.twitter.com,France,,,311880926,Etalab,1,Service du Premier ministre qui met à disposition et utilise les données pour améliorer l’action publique. L’équipe derrière @datagouvfr et @eigforever.,http://www.etalab.gouv.fr,https://pbs.twimg.com/profile_images/1067688380111171584/2ZRwOuxE_normal.jpg,4817,32950,210,1755,1254,2011-06-06T06:47:23,1307342843,scraping,1,,,,,1392475827850424323,_DITP,159161738,1620827082,2021-11-19T07:16:24.606527,https://twitter.com/Etalab/statuses/1394310221464494081,,,,,http://bit.ly/Mic_ouvert6|https://twitter.com/_DITP/status/1392475827850424323,bit.ly|twitter.com,https://pbs.twimg.com/media/E1L1dsSXIAA9bXr.jpg,1392475827850424323_E1L1dsSXIAA9bXr.jpg,photo,_ditp|etalab|schignard|soizicpenicaud,159161738|311880926|124512591|62055977,accessibilité|algorithmes|gouvernementouvert|microouvert,,,
