query,id,timestamp_utc,local_time,user_screen_name,text,possibly_sensitive,retweet_count,like_count,reply_count,lang,to_username,to_userid,to_tweetid,source_name,source_url,user_location,lat,lng,user_id,user_name,user_verified,user_description,user_url,user_image,user_tweets,user_followers,user_friends,user_likes,user_lists,user_created_at,user_timestamp_utc,collected_via,match_query,retweeted_id,retweeted_user,retweeted_user_id,retweeted_timestamp_utc,quoted_id,quoted_user,quoted_user_id,quoted_timestamp_utc,collection_time,url,place_country_code,place_name,place_type,place_coordinates,links,domains,media_urls,media_files,media_types,mentioned_names,mentioned_ids,hashtags,intervention_type,intervention_text,intervention_url
from:@etalab,1504826933036597250,1647613673,2022-03-18T14:27:53,Etalab,"L’appel à candidatures du programme EIG est ouvert !
💻 Développeuses, développeurs
📊 Data scientists et data engineers 
🖌️ Designers
⚖️ Juristes du #numérique

…On vous attend !
https://eig.etalab.gouv.fr/participer/candidats/",0,14,15,0,fr,,,,Twitter Web App,https://mobile.twitter.com,France,,,311880926,Etalab,1,Service du Premier ministre qui met à disposition et utilise les données pour améliorer l’action publique. L’équipe derrière @datagouvfr et @eigforever.,http://www.etalab.gouv.fr,https://pbs.twimg.com/profile_images/1067688380111171584/2ZRwOuxE_normal.jpg,4907,33246,250,1849,1261,2011-06-06T06:47:23,1307342843,scraping,1,,,,,,,,,2022-03-22T07:15:19.173871,https://twitter.com/Etalab/statuses/1504826933036597250,,,,,https://eig.etalab.gouv.fr/participer/candidats/,eig.etalab.gouv.fr,,,,,,numérique,,,
from:@etalab,1503419947980148737,1647278222,2022-03-14T17:17:02,Etalab,"[Le mot de la fin] ""Ensemble, nous allons créer un service public augmenté, innovant, inclusif et moderne.""

Merci d'avoir suivi cet événement ! 

Rendez-vous sur http://citoyens.transformation.gouv.fr pour plus de d'informations sur l'accélérateur et les projets accompagnés.",0,1,3,0,fr,,,,Twitter Web App,https://mobile.twitter.com,France,,,311880926,Etalab,1,Service du Premier ministre qui met à disposition et utilise les données pour améliorer l’action publique. L’équipe derrière @datagouvfr et @eigforever.,http://www.etalab.gouv.fr,https://pbs.twimg.com/profile_images/1067688380111171584/2ZRwOuxE_normal.jpg,4907,33246,250,1849,1261,2011-06-06T06:47:23,1307342843,scraping,1,,,,,,,,,2022-03-22T07:15:19.174344,https://twitter.com/Etalab/statuses/1503419947980148737,,,,,http://citoyens.transformation.gouv.fr,citoyens.transformation.gouv.fr,,,,,,,,,
from:@etalab,1503419092321161221,1647278018,2022-03-14T17:13:38,Etalab,".@AdeMontchalin  ""L’événement d’aujourd’hui a une suite européenne dès mercredi. Il sera au cœur de l’échange que j'aurai avec mes homologues européens.""",,1,3,0,fr,,,,Twitter Web App,https://mobile.twitter.com,France,,,311880926,Etalab,1,Service du Premier ministre qui met à disposition et utilise les données pour améliorer l’action publique. L’équipe derrière @datagouvfr et @eigforever.,http://www.etalab.gouv.fr,https://pbs.twimg.com/profile_images/1067688380111171584/2ZRwOuxE_normal.jpg,4907,33246,250,1849,1261,2011-06-06T06:47:23,1307342843,scraping,1,,,,,,,,,2022-03-22T07:15:19.174626,https://twitter.com/Etalab/statuses/1503419092321161221,,,,,,,,,,ademontchalin,800435764966215680,,,,
from:@etalab,1503418121062961152,1647277786,2022-03-14T17:09:46,Etalab,"L'accélérateur d'initiatives citoyennes se construit en complémentarité avec les structures d’incubation et d’innovation existantes, qu’elles soient internes à l’administration ou externes cc @ANCTerritoires  #FrenchImpact @bayesimpact @Ma_Billard1 https://twitter.com/Etalab/status/1503418121062961152/photo/1",0,2,8,0,fr,,,,Twitter Web App,https://mobile.twitter.com,France,,,311880926,Etalab,1,Service du Premier ministre qui met à disposition et utilise les données pour améliorer l’action publique. L’équipe derrière @datagouvfr et @eigforever.,http://www.etalab.gouv.fr,https://pbs.twimg.com/profile_images/1067688380111171584/2ZRwOuxE_normal.jpg,4907,33246,250,1849,1261,2011-06-06T06:47:23,1307342843,scraping,1,,,,,,,,,2022-03-22T07:15:19.175307,https://twitter.com/Etalab/statuses/1503418121062961152,,,,,,,https://pbs.twimg.com/media/FN02pmIX0AY-gMO.jpg|https://pbs.twimg.com/media/FN02ppNWUAUBZxI.jpg|https://pbs.twimg.com/media/FN02pu8WQAU6Xiv.jpg,1503418121062961152_FN02pmIX0AY-gMO.jpg|1503418121062961152_FN02ppNWUAUBZxI.jpg|1503418121062961152_FN02pu8WQAU6Xiv.jpg,photo|photo|photo,ancterritoires|bayesimpact|ma_billard1,2527819680|2455929786|886506554299731968,frenchimpact,,,
from:@etalab,1503414004802326528,1647276805,2022-03-14T16:53:25,Etalab,"Échange avec d'autres projets lauréats de l'Accélérateur d'Initiatives Citoyennes et des agents publics qui vont les accompagner : @vikidiafr, @framaka de la direction du numérique pour l'éducation, @infoclimat, Hélène Begon-Tavera @Ecologie_Gouv, Ludovic Dardenne de @assoP2C https://twitter.com/Etalab/status/1503414004802326528/photo/1",0,11,25,1,fr,,,,Twitter Web App,https://mobile.twitter.com,France,,,311880926,Etalab,1,Service du Premier ministre qui met à disposition et utilise les données pour améliorer l’action publique. L’équipe derrière @datagouvfr et @eigforever.,http://www.etalab.gouv.fr,https://pbs.twimg.com/profile_images/1067688380111171584/2ZRwOuxE_normal.jpg,4907,33246,250,1849,1261,2011-06-06T06:47:23,1307342843,scraping,1,,,,,,,,,2022-03-22T07:15:19.176121,https://twitter.com/Etalab/statuses/1503414004802326528,,,,,,,https://pbs.twimg.com/media/FN0xlbdWQAM2B9D.jpg|https://pbs.twimg.com/media/FN0xldrWUAIEo2V.jpg|https://pbs.twimg.com/media/FN0yKwFWYAA8txZ.jpg|https://pbs.twimg.com/media/FN0ywllWYAIgIHx.jpg,1503414004802326528_FN0xlbdWQAM2B9D.jpg|1503414004802326528_FN0xldrWUAIEo2V.jpg|1503414004802326528_FN0yKwFWYAA8txZ.jpg|1503414004802326528_FN0ywllWYAIgIHx.jpg,photo|photo|photo|photo,assop2c|ecologie_gouv|framaka|infoclimat|vikidiafr,1367810750278995971|368980703|48297189|148758469|2582059590,,,,
from:@etalab,1503408921146494981,1647275593,2022-03-14T16:33:13,Etalab,"🗣️""Ce programme est aussi riche pour nous parce que cela nous donne des cas d’usage."" @laurelucchesi sur les opportunités qu'offre l'accélérateur à l'administration #AIC",,0,3,0,fr,,,,Twitter Web App,https://mobile.twitter.com,France,,,311880926,Etalab,1,Service du Premier ministre qui met à disposition et utilise les données pour améliorer l’action publique. L’équipe derrière @datagouvfr et @eigforever.,http://www.etalab.gouv.fr,https://pbs.twimg.com/profile_images/1067688380111171584/2ZRwOuxE_normal.jpg,4907,33246,250,1849,1261,2011-06-06T06:47:23,1307342843,scraping,1,,,,,,,,,2022-03-22T07:15:19.176360,https://twitter.com/Etalab/statuses/1503408921146494981,,,,,,,,,,laurelucchesi,71759599,aic,,,
from:@etalab,1503407971711258636,1647275367,2022-03-14T16:29:27,Etalab,"Augustin Courtier de @LatitudesTfG, Irène Colonna d'Istria de @makesense et Margot Debaisieux de l'association Les enfants de la balle racontent l'origine de leurs projets et exposent leurs attentes vis à vis de l'#AIC 

👉Découvrez leurs projets sur http://citoyens.transformation.gouv.fr https://twitter.com/Etalab/status/1503407971711258636/photo/1",0,1,3,0,fr,,,,Twitter Web App,https://mobile.twitter.com,France,,,311880926,Etalab,1,Service du Premier ministre qui met à disposition et utilise les données pour améliorer l’action publique. L’équipe derrière @datagouvfr et @eigforever.,http://www.etalab.gouv.fr,https://pbs.twimg.com/profile_images/1067688380111171584/2ZRwOuxE_normal.jpg,4907,33246,250,1849,1261,2011-06-06T06:47:23,1307342843,scraping,1,,,,,,,,,2022-03-22T07:15:19.176775,https://twitter.com/Etalab/statuses/1503407971711258636,,,,,http://citoyens.transformation.gouv.fr,citoyens.transformation.gouv.fr,https://pbs.twimg.com/media/FN0r4P0XEAIlWBB.jpg,1503407971711258636_FN0r4P0XEAIlWBB.jpg,photo,latitudestfg|makesense,893767287240626177|102468337,aic,,,
from:@etalab,1503404389716971520,1647274513,2022-03-14T16:15:13,Etalab,"Quel accompagnement pour les projets de #AIC ?

1⃣Les lauréats seront accompagnés pendant 3 mois
2⃣Une quinzaine vont recevoir un coup de pouce pour passer de l’idée à un projet.
3⃣Pour tous, une série d’événements ouverts, thématisés par champs de politique publique.",,1,7,0,fr,,,,Twitter Web App,https://mobile.twitter.com,France,,,311880926,Etalab,1,Service du Premier ministre qui met à disposition et utilise les données pour améliorer l’action publique. L’équipe derrière @datagouvfr et @eigforever.,http://www.etalab.gouv.fr,https://pbs.twimg.com/profile_images/1067688380111171584/2ZRwOuxE_normal.jpg,4907,33246,250,1849,1261,2011-06-06T06:47:23,1307342843,scraping,1,,,,,,,,,2022-03-22T07:15:19.177033,https://twitter.com/Etalab/statuses/1503404389716971520,,,,,,,,,,,,aic,,,
from:@etalab,1503402633977020418,1647274094,2022-03-14T16:08:14,Etalab,"Félicitations aux initiatives lauréates portées par @vikidiafr @madadafr @infoclimat @LatitudesTfG @makesense @assoP2C @ParlonsDem @Vivons_en_Forme et l’association Les enfants de la balle !

Plus de détails sur les projets à la fin du live 👉http://citoyens.transformation.gouv.fr #AIC https://twitter.com/Etalab/status/1503402633977020418/photo/1",0,21,45,2,fr,,,,Twitter Web App,https://mobile.twitter.com,France,,,311880926,Etalab,1,Service du Premier ministre qui met à disposition et utilise les données pour améliorer l’action publique. L’équipe derrière @datagouvfr et @eigforever.,http://www.etalab.gouv.fr,https://pbs.twimg.com/profile_images/1067688380111171584/2ZRwOuxE_normal.jpg,4907,33246,250,1849,1261,2011-06-06T06:47:23,1307342843,scraping,1,,,,,,,,,2022-03-22T07:15:19.177504,https://twitter.com/Etalab/statuses/1503402633977020418,,,,,http://citoyens.transformation.gouv.fr,citoyens.transformation.gouv.fr,https://pbs.twimg.com/media/FN0osNtXEAkr6gK.jpg,1503402633977020418_FN0osNtXEAkr6gK.jpg,photo,assop2c|infoclimat|latitudestfg|madadafr|makesense|parlonsdem|vikidiafr|vivons_en_forme,1367810750278995971|148758469|893767287240626177|1346424982184849408|102468337|1244899923520303104|2582059590|3291923709,aic,,,
from:@etalab,1503401085767139329,1647273725,2022-03-14T16:02:05,Etalab,"Qu'est-ce que ça fait de participer au panel citoyen ? #AIC
""Je me suis rendu compte que le service public sert à quelque chose. On peut avancer, on peut innover, ce n’est pas une entité lointaine.""
""Ça rendait le service public plus humain, moins froid, moins machine de guerre."" https://twitter.com/Etalab/status/1503401085767139329/photo/1",0,3,7,0,fr,,,,Twitter Web App,https://mobile.twitter.com,France,,,311880926,Etalab,1,Service du Premier ministre qui met à disposition et utilise les données pour améliorer l’action publique. L’équipe derrière @datagouvfr et @eigforever.,http://www.etalab.gouv.fr,https://pbs.twimg.com/profile_images/1067688380111171584/2ZRwOuxE_normal.jpg,4907,33246,250,1849,1261,2011-06-06T06:47:23,1307342843,scraping,1,,,,,,,,,2022-03-22T07:15:19.177901,https://twitter.com/Etalab/statuses/1503401085767139329,,,,,,,https://pbs.twimg.com/media/FN0nKxWX0AAyIIT.jpg,1503401085767139329_FN0nKxWX0AAyIIT.jpg,photo,,,aic,,,
from:@etalab,1503400112697008133,1647273493,2022-03-14T15:58:13,Etalab,Retour sur les modalités originales de l'examen des candidatures à #AIC : deux membres du panel citoyen témoignent. https://twitter.com/Etalab/status/1503400112697008133/photo/1,0,2,7,0,fr,,,,Twitter Web App,https://mobile.twitter.com,France,,,311880926,Etalab,1,Service du Premier ministre qui met à disposition et utilise les données pour améliorer l’action publique. L’équipe derrière @datagouvfr et @eigforever.,http://www.etalab.gouv.fr,https://pbs.twimg.com/profile_images/1067688380111171584/2ZRwOuxE_normal.jpg,4907,33246,250,1849,1261,2011-06-06T06:47:23,1307342843,scraping,1,,,,,,,,,2022-03-22T07:15:19.178273,https://twitter.com/Etalab/statuses/1503400112697008133,,,,,,,https://pbs.twimg.com/media/FN0mXToXwA8jBY2.jpg,1503400112697008133_FN0mXToXwA8jBY2.jpg,photo,,,aic,,,
from:@etalab,1503398579716734976,1647273127,2022-03-14T15:52:07,Etalab,".@AdeMontchalin lance l'événement #AIC 
🗣️""Il est essentiel de renforcer les ponts entre le monde de l’administration et les citoyens [pour] construire le service public augmenté de toutes les initiatives citoyennes."" https://twitter.com/Etalab/status/1503398579716734976/photo/1",0,2,10,0,fr,,,,Twitter Web App,https://mobile.twitter.com,France,,,311880926,Etalab,1,Service du Premier ministre qui met à disposition et utilise les données pour améliorer l’action publique. L’équipe derrière @datagouvfr et @eigforever.,http://www.etalab.gouv.fr,https://pbs.twimg.com/profile_images/1067688380111171584/2ZRwOuxE_normal.jpg,4907,33246,250,1849,1261,2011-06-06T06:47:23,1307342843,scraping,1,,,,,,,,,2022-03-22T07:15:19.178634,https://twitter.com/Etalab/statuses/1503398579716734976,,,,,,,https://pbs.twimg.com/media/FN0k0NrWYA8Klsk.jpg,1503398579716734976_FN0k0NrWYA8Klsk.jpg,photo,ademontchalin,800435764966215680,aic,,,
from:@etalab,1503395932532260864,1647272496,2022-03-14T15:41:36,Etalab,"[📽️live] L’annonce des projets lauréats du premier appel à candidature de l’Accélérateur d’Initiatives Citoyennes, c'est maintenant sur @AdeMontchalin !

On commence le live tweet #AIC cc @_DINUM @_DITP https://twitter.com/Etalab/status/1503395932532260864/photo/1",0,1,12,0,fr,,,,Twitter Web App,https://mobile.twitter.com,France,,,311880926,Etalab,1,Service du Premier ministre qui met à disposition et utilise les données pour améliorer l’action publique. L’équipe derrière @datagouvfr et @eigforever.,http://www.etalab.gouv.fr,https://pbs.twimg.com/profile_images/1067688380111171584/2ZRwOuxE_normal.jpg,4907,33246,250,1849,1261,2011-06-06T06:47:23,1307342843,scraping,1,,,,,,,,,2022-03-22T07:15:19.179007,https://twitter.com/Etalab/statuses/1503395932532260864,,,,,,,https://pbs.twimg.com/media/FN0ij3yXMAE6gnT.jpg,1503395932532260864_FN0ij3yXMAE6gnT.jpg,photo,_dinum|_ditp|ademontchalin,4910809053|159161738|800435764966215680,aic,,,
from:@etalab,1502273167171194886,1647004808,2022-03-11T13:20:08,Etalab,"[Accélérateur d'initiatives citoyennes] Associations, entreprises, bénévoles : vs avez été près de 200 à proposer des initiatives d’intérêt général 🙌🙌 

▶️ RDV lundi 14/3 sur @AdeMontchalin pr découvrir en direct 🎥 la 1e PROMOTION DE LAUREATS !
http://citoyens.transformation.gouv.fr #AIC https://twitter.com/Etalab/status/1502273167171194886/photo/1",0,17,26,0,fr,,,,Twitter Web App,https://mobile.twitter.com,France,,,311880926,Etalab,1,Service du Premier ministre qui met à disposition et utilise les données pour améliorer l’action publique. L’équipe derrière @datagouvfr et @eigforever.,http://www.etalab.gouv.fr,https://pbs.twimg.com/profile_images/1067688380111171584/2ZRwOuxE_normal.jpg,4907,33246,250,1849,1261,2011-06-06T06:47:23,1307342843,scraping,1,,,,,,,,,2022-03-22T07:15:19.555298,https://twitter.com/Etalab/statuses/1502273167171194886,,,,,http://citoyens.transformation.gouv.fr,citoyens.transformation.gouv.fr,https://pbs.twimg.com/media/FNklezzXMAMErqa.jpg,1502273167171194886_FNklezzXMAMErqa.jpg,photo,ademontchalin,800435764966215680,aic,,,
from:@etalab,1486273778929778691,1643190257,2022-01-26T09:44:17,Etalab,"🇪🇺 Pourquoi la France est à la première du classement européen en matière d’#opendata ? 
Quelles sont les bonnes pratiques françaises et les axes d’améliorations ? Aujourd'hui : la qualité des données
➡️ https://www.etalab.gouv.fr/retour-sur-lopen-data-maturity-index-2021-qualite-des-donnees-ouvertes-4-4 https://twitter.com/Etalab/status/1486273778929778691/photo/1",0,1,6,0,fr,Etalab,311880926,1482996796477657088,Twitter Web App,https://mobile.twitter.com,France,,,311880926,Etalab,1,Service du Premier ministre qui met à disposition et utilise les données pour améliorer l’action publique. L’équipe derrière @datagouvfr et @eigforever.,http://www.etalab.gouv.fr,https://pbs.twimg.com/profile_images/1067688380111171584/2ZRwOuxE_normal.jpg,4907,33246,250,1849,1261,2011-06-06T06:47:23,1307342843,scraping,1,,,,,,,,,2022-03-22T07:15:19.555828,https://twitter.com/Etalab/statuses/1486273778929778691,,,,,https://www.etalab.gouv.fr/retour-sur-lopen-data-maturity-index-2021-qualite-des-donnees-ouvertes-4-4,etalab.gouv.fr,https://pbs.twimg.com/media/FKBOF51XEAMkuir.jpg,1486273778929778691_FKBOF51XEAMkuir.jpg,photo,,,opendata,,,
from:@etalab,1485898631173615616,1643100814,2022-01-25T08:53:34,Etalab,"⌛️ J-1 avant la clôture de l'appel à candidatures de l'Accélérateur d'initiatives citoyennes ! 

Vous avez un projet d'utilité publique ? Gagnez du temps & bénéficiez d'un accompagnement sur mesure 🚀

⏩ Déposez un dossier en - 30min avant le 26/1  https://citoyens.transformation.gouv.fr/faq.html https://twitter.com/Etalab/status/1485898631173615616/photo/1",0,10,22,3,fr,,,,Twitter Web App,https://mobile.twitter.com,France,,,311880926,Etalab,1,Service du Premier ministre qui met à disposition et utilise les données pour améliorer l’action publique. L’équipe derrière @datagouvfr et @eigforever.,http://www.etalab.gouv.fr,https://pbs.twimg.com/profile_images/1067688380111171584/2ZRwOuxE_normal.jpg,4907,33246,250,1849,1261,2011-06-06T06:47:23,1307342843,scraping,1,,,,,,,,,2022-03-22T07:15:19.556323,https://twitter.com/Etalab/statuses/1485898631173615616,,,,,https://citoyens.transformation.gouv.fr/faq.html,citoyens.transformation.gouv.fr,https://pbs.twimg.com/media/FJ70xbxX0AIvK3M.jpg,1485898631173615616_FJ70xbxX0AIvK3M.jpg,photo,,,,,,
from:@etalab,1484187358584999941,1642692815,2022-01-20T15:33:35,Etalab,"Vous voulez en savoir plus sur les marchés interministériels d'expertise et de support #LogicielsLibres ? 

👉http://communs.numerique.gouv.fr/utiliser/marches-interministeriels-support-expertise-logiciels-libres/

❓N'hésitez pas à demander plus d'informations à logiciels-libres@data.gouv.fr

cc @dgfip_officiel @_DINUM",0,5,11,0,fr,,,,Twitter Web App,https://mobile.twitter.com,France,,,311880926,Etalab,1,Service du Premier ministre qui met à disposition et utilise les données pour améliorer l’action publique. L’équipe derrière @datagouvfr et @eigforever.,http://www.etalab.gouv.fr,https://pbs.twimg.com/profile_images/1067688380111171584/2ZRwOuxE_normal.jpg,4907,33246,250,1849,1261,2011-06-06T06:47:23,1307342843,scraping,1,,,,,1484116427414155264,codegouvfr,1417500670781964292,1642675904,2022-03-22T07:15:19.556963,https://twitter.com/Etalab/statuses/1484187358584999941,,,,,http://communs.numerique.gouv.fr/utiliser/marches-interministeriels-support-expertise-logiciels-libres/|https://communs.numerique.gouv.fr/utiliser/marches-interministeriels-support-expertise-logiciels-libres/,communs.numerique.gouv.fr|communs.numerique.gouv.fr,,,,_dinum|dgfip_officiel,4910809053|962532618,logicielslibres,,,
from:@etalab,1482996796477657088,1642408963,2022-01-17T08:42:43,Etalab,"🇪🇺 Pourquoi la France est à la première du classement européen en matière d’#opendata ? 
Quelles sont les bonnes pratiques françaises et les axes d’améliorations ? Aujourd'hui : la qualité du portail
➡️ https://www.etalab.gouv.fr/retour-sur-lopen-data-maturity-index-2021-qualite-du-portail-de-donnees-3-4 https://twitter.com/Etalab/status/1482996796477657088/photo/1",0,11,12,1,fr,Etalab,311880926,1480585728631492618,Twitter Web App,https://mobile.twitter.com,France,,,311880926,Etalab,1,Service du Premier ministre qui met à disposition et utilise les données pour améliorer l’action publique. L’équipe derrière @datagouvfr et @eigforever.,http://www.etalab.gouv.fr,https://pbs.twimg.com/profile_images/1067688380111171584/2ZRwOuxE_normal.jpg,4907,33246,250,1849,1261,2011-06-06T06:47:23,1307342843,scraping,1,,,,,,,,,2022-03-22T07:15:19.557430,https://twitter.com/Etalab/statuses/1482996796477657088,,,,,https://www.etalab.gouv.fr/retour-sur-lopen-data-maturity-index-2021-qualite-du-portail-de-donnees-3-4,etalab.gouv.fr,https://pbs.twimg.com/media/FJSpqJlWQAEGOER.jpg,1482996796477657088_FJSpqJlWQAEGOER.jpg,photo,,,opendata,,,
from:@etalab,1480585728631492618,1641834120,2022-01-10T17:02:00,Etalab,"🇪🇺 Pourquoi la France est à la première place du classement européen en matière d’#opendata ? 
Quelles sont les bonnes pratiques françaises et les axes d’améliorations ?
Aujourd'hui : la mesure de l'impact.

➡️ https://www.etalab.gouv.fr/retour-sur-lopen-data-maturity-index-2021-mesure-de-limpact-de-louverture-des-donnees-2-4 https://twitter.com/Etalab/status/1480585728631492618/photo/1",0,8,15,1,fr,Etalab,311880926,1478036932550705164,TweetDeck,https://about.twitter.com/products/tweetdeck,France,,,311880926,Etalab,1,Service du Premier ministre qui met à disposition et utilise les données pour améliorer l’action publique. L’équipe derrière @datagouvfr et @eigforever.,http://www.etalab.gouv.fr,https://pbs.twimg.com/profile_images/1067688380111171584/2ZRwOuxE_normal.jpg,4907,33246,250,1849,1261,2011-06-06T06:47:23,1307342843,scraping,1,,,,,,,,,2022-03-22T07:15:19.557905,https://twitter.com/Etalab/statuses/1480585728631492618,,,,,https://www.etalab.gouv.fr/retour-sur-lopen-data-maturity-index-2021-mesure-de-limpact-de-louverture-des-donnees-2-4,etalab.gouv.fr,https://pbs.twimg.com/media/FIvsH7hXIAQqHXw.jpg,1480585728631492618_FIvsH7hXIAQqHXw.jpg,photo,,,opendata,,,
from:@etalab,1479044904462561283,1641466759,2022-01-06T10:59:19,Etalab,"🧑‍💻Pour en savoir plus sur l’Accélérateur d’Initiatives Citoyennes et son appel à candidatures : http://citoyens.transformation.gouv.fr

❓Si vous avez encore des questions, contactez nous : accelerateur@data.gouv.fr [5/5]",0,0,3,1,fr,Etalab,311880926,1479044901560012802,Twitter Web App,https://mobile.twitter.com,France,,,311880926,Etalab,1,Service du Premier ministre qui met à disposition et utilise les données pour améliorer l’action publique. L’équipe derrière @datagouvfr et @eigforever.,http://www.etalab.gouv.fr,https://pbs.twimg.com/profile_images/1067688380111171584/2ZRwOuxE_normal.jpg,4907,33246,250,1849,1261,2011-06-06T06:47:23,1307342843,scraping,1,,,,,,,,,2022-03-22T07:15:19.558209,https://twitter.com/Etalab/statuses/1479044904462561283,,,,,http://citoyens.transformation.gouv.fr,citoyens.transformation.gouv.fr,,,,,,,,,
from:@etalab,1479044901560012802,1641466758,2022-01-06T10:59:18,Etalab,"À partir de février 2022, tous les 3 mois, un jury composé de 15 citoyens tirés au sort choisira 10 initiatives qui seront soutenues par l’État.

Ce dispositif est porté par Etalab à la @DINUM et par la @DITP CC @laurelucchesi @Ma_Billard1 @AChampsavin [4/5] https://twitter.com/Etalab/status/1479044901560012802/photo/1",0,2,6,1,fr,Etalab,311880926,1479044897508372485,Twitter Web App,https://mobile.twitter.com,France,,,311880926,Etalab,1,Service du Premier ministre qui met à disposition et utilise les données pour améliorer l’action publique. L’équipe derrière @datagouvfr et @eigforever.,http://www.etalab.gouv.fr,https://pbs.twimg.com/profile_images/1067688380111171584/2ZRwOuxE_normal.jpg,4907,33246,250,1849,1261,2011-06-06T06:47:23,1307342843,scraping,1,,,,,,,,,2022-03-22T07:15:19.558651,https://twitter.com/Etalab/statuses/1479044901560012802,,,,,,,https://pbs.twimg.com/media/FIaPmsuWQAYBQcN.jpg,1479044901560012802_FIaPmsuWQAYBQcN.jpg,photo,achampsavin|dinum|ditp|laurelucchesi|ma_billard1,1044259184894717953|2218841071|40566858|71759599|886506554299731968,,,,
from:@etalab,1479044897508372485,1641466757,2022-01-06T10:59:17,Etalab,".@AdeMontchalin a lancé l’Accélérateur d’Initiatives Citoyennes en décembre 2021 pour unir les forces des citoyens et des agents publics.

Objectif : faire émerger les futurs @1001_mots @OpenFoodFactsFr @Solinum @LesAstroliens @ViteMaDose_off @covidliste @BriserLaChaine [3/5] https://twitter.com/Etalab/status/1479044897508372485/photo/1",0,0,5,1,fr,Etalab,311880926,1479044892592586756,Twitter Web App,https://mobile.twitter.com,France,,,311880926,Etalab,1,Service du Premier ministre qui met à disposition et utilise les données pour améliorer l’action publique. L’équipe derrière @datagouvfr et @eigforever.,http://www.etalab.gouv.fr,https://pbs.twimg.com/profile_images/1067688380111171584/2ZRwOuxE_normal.jpg,4907,33246,250,1849,1261,2011-06-06T06:47:23,1307342843,scraping,1,,,,,,,,,2022-03-22T07:15:19.559362,https://twitter.com/Etalab/statuses/1479044897508372485,,,,,,,https://pbs.twimg.com/media/FIaTFyhXoAc3i1o.jpg|https://pbs.twimg.com/media/FIaTR0RWQAE9l_w.jpg|https://pbs.twimg.com/media/FIaT4QkXwAwzAb0.jpg,1479044897508372485_FIaTFyhXoAc3i1o.jpg|1479044897508372485_FIaTR0RWQAE9l_w.jpg|1479044897508372485_FIaT4QkXwAwzAb0.jpg,photo|photo|photo,1001_mots|ademontchalin|briserlachaine|covidliste|lesastroliens|openfoodfactsfr|solinum|vitemadose_off,985999316668985344|800435764966215680|1255155703183929345|1377518162573463552|796046687340994560|584043179|19989416|1378388277456175106,,,,
